Community,Id,Request,Score1,Score2,Score3,Score4,Score5,TurkId1,TurkId2,TurkId3,TurkId4,TurkId5,Normalized Score,Average,Classification,
092011 Stack Overflow,1709911,"I don't understand your concern with ""the user might think that margins contains only :left and :right"". How is it different when you use the chart.marings(:left, 10) syntax ?",15,11,11,5,13,ARYGQ46IMW8AU,A28ZB4ZB13BWAI,A14TK8NCD4CUN1,AO3XB5I5QNNUI,A34M93NJC830DP,-0.581894183,11,Rude,0.239321173
092011 Stack Overflow,6787182,With 6 rows you will end up with ids 1-5 having value 166 and id 6 with value 170. Sure you want that?,9,14,9,12,11,A1K8E2E0HHRZ4S,A2NPNKSW89BODS,A233ONYNWKDIYF,A150TBAWIYV8J4,A39FH0T1NKKMVO,-0.466428732,11,Rude,0.817706722
092011 Bicycles,3857,"Never needed to coat the inside of a frame, WD40 is useful to get any water out. I suppose car wax could work?",13,9,13,15,5,AO3XB5I5QNNUI,A233ONYNWKDIYF,A2UFD1I8ZO1V4G,ARX0S1CIDJLOX,AI4WWBB2PNCKH,-0.478885137,11,Rude,0.254774329
092011 Stack Overflow,4820853,How's that even possible? Why don't you join the stdout to the logcat output and try to print that massive log directly on stdout?,17,9,9,9,11,A3OW54MEVDKXJL,A28ZB4ZB13BWAI,A1GK3MPU2HL0C8,A3DGKW5JY87RCH,A2WGBPEN45GJNF,-0.725350439,11,Rude,0.873422073
092011 Stack Overflow,2285372,"Given all the software tools out there (IDEs, refactoring tools, text search tools etc.) why do you want to write this from scratch yourself?",5,9,17,13,11,A1LZIWJ3V05K3H,A3B5ZWLZFI90WM,A1G05O3HM7DNVZ,A14TK8NCD4CUN1,A3TXO6RKFIDFUV,-0.444493693,11,Rude,0.075288557
092011 TeX - LaTeX,1028,"Some clarification questions: 1) Do you want BibTeX to get the information _directly_ from the database, or are you prepared to extract it yourself in .bib format?  2) Do you already have the information in a database in a specific format and want to use only that, or would you be happy converting to another bibliographic database system?",9,9,11,9,17,AO3XB5I5QNNUI,A233ONYNWKDIYF,A1ZHP80O13CEUI,A32VJLRWGMYGSU,ARX0S1CIDJLOX,-0.623481927,11,Rude,0.668113116
092011 WordPress,2766,"Thank you, I will give this a try tomorrow but could you please explain how to do different validations. For example validating for an correct email address, validating that there are no more than or at least XX characters, that a form field is filled out... things like that?",9,5,17,11,13,AYG3MF094634L,A3CFNUD7VR2E1E,A3E157ZN8XPUKJ,ARYGQ46IMW8AU,A2UFD1I8ZO1V4G,-0.989777194,11,Rude,0.244656502
092011 Stack Overflow,709795,Can you please clarify your question so it's clear what you're asking for. Do you want examples of functional and non-functional requirements in the problem specification?,9,9,11,9,17,A1LZIWJ3V05K3H,A3OW54MEVDKXJL,A1F4D2PZ7NNWTL,A34NDXO56MBC3D,A34M93NJC830DP,-0.504006322,11,Rude,0.084718537
092011 Apple,3818,"Sorry, we were discussing iPad, but we did go through the overall state of Apple's products. Can you please address the other parts of the question?",11,9,13,13,9,AYG3MF094634L,A233ONYNWKDIYF,ALQJX7I6J8LDT,A2UFD1I8ZO1V4G,A1LRRDBA84ITCJ,-0.851805497,11,Rude,0.369010108
092011 Stack Overflow,2345506,How is it awkward? Which version of VS (they have different levels of js intellisense support)?,13,13,11,9,9,AYG3MF094634L,A2Y0ZGI29KQBTB,A14TK8NCD4CUN1,AFD31LP2ZU9G7,A3OY0OL2M0HUTT,-0.686213626,11,Rude,0.237177362
092011 Stack Overflow,5570643,You say it's not compiling. Do you understand the error message?,11,17,9,5,13,A3R637QBE0IXDF,A3E157ZN8XPUKJ,AO3XB5I5QNNUI,A3DKR227NQCH4X,A2GSW5RBAT5LQ5,-0.80071743,11,Rude,0.175499303
092011 Android Enthusiasts,2994,Depending on how you do it you won't lose any data. Which build do you have now?,9,9,9,13,15,AO3XB5I5QNNUI,A3E157ZN8XPUKJ,A1VIEFZYI54JHP,A2UFD1I8ZO1V4G,A28TXBSZPWMEU9,-0.708355316,11,Rude,0.73684616
092011 Stack Overflow,3740112,Why are you putting control characters into the string? And don't they count to whatever length limits apply?,10,17,5,5,18,A3RP70I4XDGOIS,A3OW54MEVDKXJL,A1M1T2EF4Y2IW8,A872FSFU7WV6W,A1HBDQ0BJQBA4Q,-0.400938514,11,Rude,0.795567736
092011 Stack Overflow,4782829,This looks suspiciously like homework. Could you elaborate a little more ?,13,12,6,19,5,A416CQ0FIDNFT,A28TXBSZPWMEU9,AO2NFSIXUL5MT,A17G2LOYX7WQZ,A3DKR227NQCH4X,-0.471654603,11,Rude,0.205195051
092011 Stack Overflow,7260726,Are both versions being run as the same user? Whats in `$?` when it fails?,1,13,15,13,13,A3H8M155NBFE1L,A3MMLCBV2W3BP9,A2BKPNKU3EG41Z,A2WGBPEN45GJNF,A34M93NJC830DP,-0.392570387,11,Rude,0.072985824
092011 Stack Overflow,2713888,"What do you mean by ""by default, the week starts at Monday""? I'm not saying that's not true, but how/where do you experience that in your code?",13,9,19,5,9,A2UFD1I8ZO1V4G,A1G05O3HM7DNVZ,A2BKPNKU3EG41Z,A3DKR227NQCH4X,A39FH0T1NKKMVO,-0.661432298,11,Rude,0.145093925
092011 Programmers,6309,"I would go and say, ""I can't find any problem. Are you sure it's not the user?""",9,9,12,12,13,AO3XB5I5QNNUI,A2TVQMMI5TNQPJ,A3RLCGRXA34GC0,A28TXBSZPWMEU9,A22SZHZTF72TRM,-0.706573583,11,Rude,0.654982799
092011 Stack Overflow,4639186,I know I can lose characters. But you find it normal that half the text after a particular character is lost though it does not contain special chars ?,11,5,13,13,13,ARYGQ46IMW8AU,AO3XB5I5QNNUI,A2WGBPEN45GJNF,A150TBAWIYV8J4,A28WCYNS229OHH,-0.807198597,11,Rude,0.67373828
092011 Stack Overflow,3146454,I think we must sort the group for select algorithm but it is not necessary for sorting the elements in the quick select algorithm !! isn't it?,13,16,5,9,12,AYG3MF094634L,A3EJ5TT2ZGBIDA,A872FSFU7WV6W,A2BKPNKU3EG41Z,A34M93NJC830DP,-0.713497231,11,Rude,0.047393909
092011 Stack Overflow,5031165,So what exactly is the problem? Changing the size doesn't work?,9,13,13,9,11,A233ONYNWKDIYF,A28TXBSZPWMEU9,A1G05O3HM7DNVZ,A1WVVULO7SS6AY,A312BVGKE6BAS5,-0.712995679,11,Rude,0.60765036
092011 Stack Overflow,3251111,"Innovative?  You mean, something that uses genetic algorithms that cloud compute on quantum computers?",13,13,11,9,9,A2UFD1I8ZO1V4G,A23FB7HE970AZJ,A3MMLCBV2W3BP9,A3DKR227NQCH4X,A39FH0T1NKKMVO,-0.579846263,11,Rude,0.902181299
092011 Stack Overflow,7405000,"Not my question, but okay. Would you care to elaborate on this and  tell me what exactly is wrong?",16,13,12,5,9,A3RP70I4XDGOIS,A2UFD1I8ZO1V4G,A14TK8NCD4CUN1,A872FSFU7WV6W,A3OY0OL2M0HUTT,-0.435864203,11,Rude,0.021961449
092011 Stack Overflow,779761,Polynomial of what? Number of points defining the space?,20,12,9,13,1,ATHS9GUME1XCA,A28ZB4ZB13BWAI,A17G2LOYX7WQZ,A2WGBPEN45GJNF,A3DKR227NQCH4X,-0.778714776,11,Rude,0.736110711
092011 Stack Overflow,7999603,I would suggest you reconsider if using the `*` selector is a good idea. Maybe what you want to do is possible without iterating over the zillion elements that make up a production web page?,8,5,17,16,9,A3RP70I4XDGOIS,A3I83CQLOZRO79,A2Y0ZGI29KQBTB,A14TK8NCD4CUN1,A125P73OQSRNI5,-0.544062896,11,Rude,0.888141272
092011 Apple,4396,Are you running the latest update (10.5.8 or 10.6.5?). Is 'bluetooth devices can wake up' enabled?,13,9,13,7,13,AYG3MF094634L,A233ONYNWKDIYF,A2UFD1I8ZO1V4G,A1FF4KWG1G44QE,AR6N5URYPDBXS,-0.498793033,11,Rude,0.312663643
092011 Statistical Analysis,2661,"At first blush this question seems purely mathematical: visualizing the function has nothing to do with the distribution of its arguments.  However, the reference to ""heteroskedasticity"" suggests you're really trying to visualize an object that is more explicitly represented as $f(x_1, ..., x_k) + \epsilon$ or more generally as  $g(f(x_1, ..., x_k), \epsilon)$ where $epsilon$ is a zero-mean random variable and $g(z,0) = z$ for all z.  Isn't this just a response-surface analysis?",9,9,12,13,12,AO3XB5I5QNNUI,A2TVQMMI5TNQPJ,A3RLCGRXA34GC0,A28TXBSZPWMEU9,A22SZHZTF72TRM,-0.681175762,11,Rude,0.716905566
092011 Stack Overflow,7170154,Why design a config file syntax that is very difficult to parse? Why not just set the relevant bash variables and source it?,12,9,13,13,9,A3RP70I4XDGOIS,A2AE4MZVUX9JPX,A28TXBSZPWMEU9,A28ZB4ZB13BWAI,AO3XB5I5QNNUI,-0.355433258,11.2,Rude,0.520192825
092011 Stack Overflow,3251150,Solve for `x`? Is there a dividebyzero.com in the SO family of sites?,13,9,13,7,14,A2UFD1I8ZO1V4G,A233ONYNWKDIYF,AYG3MF094634L,A3689IWHIHX69E,A2BKPNKU3EG41Z,-0.939802269,11.2,Rude,0.780913611
092011 Stack Overflow,6090348,How do you come up with 57? Are you allowed to divide by 2?,14,15,13,5,9,AYG3MF094634L,A28TXBSZPWMEU9,A3MMLCBV2W3BP9,AO3XB5I5QNNUI,A3EJ5TT2ZGBIDA,-0.528730865,11.2,Rude,0.156581477
092011 Stack Overflow,1671894,"If input is {{a: 1, b: 1}, {c: 1}, {b: 1, c: 1}}, do you just want {{a: 1, b: 1} , {c: 1}}, or all 3? If it's the former, what exactly do you need this for?",11,8,10,16,11,A2UME0TSE7N41G,A3EJ5TT2ZGBIDA,AD1IH74UX9IAI,AP6784DKV31O6,A3OY0OL2M0HUTT,-0.704568868,11.2,Rude,0.015966092
092011 Ask Ubuntu,1332,I think all of the issues in one questions is not ideal here. Would it be possible to separate the issues into distinct questions?,6,17,17,9,7,AO3XB5I5QNNUI,A3IS283P2CECZJ,A2UFD1I8ZO1V4G,A2JJLF3PI5XJ0I,ARX0S1CIDJLOX,-0.379306775,11.2,Rude,0.904175047
092011 Programmers,31804,"I'm sorry, but I can't understand `find the missing element in O(N) or better` What does mean *""or better""* in this context? It seems the kind of thing that would be solved with a simple while loop, but anyway I don't understand - it's either *solved* or *not solved*, right?",9,17,9,8,13,AO3XB5I5QNNUI,A3E157ZN8XPUKJ,A32VJLRWGMYGSU,A1W2G1N4BDF2DW,A1LRRDBA84ITCJ,-0.79736186,11.2,Rude,0.036767205
092011 Stack Overflow,3280157,Link? Is this homework?,13,9,18,11,5,A416CQ0FIDNFT,A2YNPKYEFDZ6C9,A17G2LOYX7WQZ,A34M93NJC830DP,A321FJYVTX5WP9,-0.589770866,11.2,Rude,0.643481654
092011 Stack Overflow,1840847,"but how?
where will i write the code snipt?",17,10,10,10,9,A3E157ZN8XPUKJ,A14TK8NCD4CUN1,A3EJ5TT2ZGBIDA,A2BKPNKU3EG41Z,AP6784DKV31O6,-1.23904805,11.2,Rude,0.999072383
092011 Stack Overflow,3118117,"The real question is , what does First returns? Since Dictionnary uses hash values, First is first of what???",14,9,16,12,5,AYG3MF094634L,A17G2LOYX7WQZ,A39FH0T1NKKMVO,A34M93NJC830DP,A3OY0OL2M0HUTT,-0.65811539,11.2,Rude,0.193830269
092011 Stack Overflow,3913219,"Nope, no sense. What's a conceptual break in this context?",4,9,13,18,12,A2UME0TSE7N41G,A3MMLCBV2W3BP9,AO3XB5I5QNNUI,A2BKPNKU3EG41Z,A2GSW5RBAT5LQ5,-0.517572183,11.2,Rude,0.509526369
092011 Stack Overflow,8537533,"""invertHash"", I suppose. But honestly, why does it matter what you name your own functions?",17,10,9,9,11,AGFHIO3UKJ9EF,A3EJ5TT2ZGBIDA,A1TWD4UTLWVYAQ,A2EV4INWSEBY6Q,A2PIUQICBRBZZY,-0.934520679,11.2,Rude,0.910156788
092011 Programmers,8620,This feels like a duplicate of http://programmers.stackexchange.com/questions/217/should-i-keep-realbasic-on-my-resume and maybe we could make that question general. (Should I keep X on my resume?),9,9,13,12,13,AO3XB5I5QNNUI,A2FNOKJNY7E5WP,A2UFD1I8ZO1V4G,A28TXBSZPWMEU9,A32VJLRWGMYGSU,-0.590228935,11.2,Rude,0.990814349
092011 Apple,1686,"So currently, you're on 3.1.2, correct? When you downgraded, did you use a stock firmware, or did you just put the redsn0w image on there right away?",13,9,16,13,5,AO3XB5I5QNNUI,A233ONYNWKDIYF,A23312XQ2AQ91W,A28TXBSZPWMEU9,ARX0S1CIDJLOX,-0.464046967,11.2,Rude,0.139604612
092011 Stack Overflow,6669226,Time to register and start giving some votes to the people that are giving you free consulting. All : Is a feature on Stackoverflow that if a user doesn't register that there is no calculation of acceptance rate?,9,13,13,9,12,A1G9ZIBMV5PLE2,A3MMLCBV2W3BP9,A28ZB4ZB13BWAI,AO3XB5I5QNNUI,A34M93NJC830DP,-0.690380652,11.2,Rude,0.342434815
092011 Stack Overflow,5818509,Do you have any experience in Visual Basic? Have you tried reading a tutorial or a book?,9,13,14,7,13,A2UFD1I8ZO1V4G,A28TXBSZPWMEU9,A14TK8NCD4CUN1,AP6784DKV31O6,A34M93NJC830DP,-0.823296297,11.2,Rude,0.614278994
092011 Stack Overflow,4798025,Is there a reason you dont just let IIS do this for you?  Or use the `<authorization>` features in your web.config?,13,5,10,15,13,A2UFD1I8ZO1V4G,ARJ44YPGA2FPK,AO3XB5I5QNNUI,A3EJ5TT2ZGBIDA,A320SR22MPGY17,-0.593326217,11.2,Rude,0.490796636
092011 Statistical Analysis,9577,"@mpiktas: what do you mean with ""additional data""? Could you please give an example of this in the car context?",9,19,10,5,13,A233ONYNWKDIYF,A23312XQ2AQ91W,ARX0S1CIDJLOX,AI4WWBB2PNCKH,A1LRRDBA84ITCJ,-0.478911882,11.2,Rude,0.126219481
092011 Stack Overflow,1974972,Could you please clarify with an example? And are we doing your homework for you?,17,11,5,13,10,A2UFD1I8ZO1V4G,A28TXBSZPWMEU9,A2ANYIYF6PV1T5,A3TXO6RKFIDFUV,A2WGBPEN45GJNF,-0.617591469,11.2,Rude,0.745548703
092011 Stack Overflow,4448046,"If you know how to get the bits into a string, then do that, and get the first five of them using a substring. Which part do you need help with?",9,5,14,12,16,APEJ17EE0VDDT,A1UZ2DD6L6DGHT,AYG3MF094634L,A14TK8NCD4CUN1,A2BKPNKU3EG41Z,-0.564439386,11.2,Rude,0.600247174
092011 Programmers,4644,did't you just ask this on the Ubuntu Forum?  Same person?,9,17,17,5,8,A233ONYNWKDIYF,A2UFD1I8ZO1V4G,A2WFNPUI1JSPG4,A1FF4KWG1G44QE,A2JJLF3PI5XJ0I,-0.395544147,11.2,Rude,0.783968565
092011 Ask Ubuntu,26076,Can you please provide some additional information: Are the lines you quote the only messages relating to granola? Which kernel version are you running?,9,13,9,17,8,A233ONYNWKDIYF,A2UFD1I8ZO1V4G,A2WFNPUI1JSPG4,A1FF4KWG1G44QE,A2JJLF3PI5XJ0I,-0.655645079,11.2,Rude,0.709005297
092011 Stack Overflow,6317489,"Yes, I am using an ""ancient"" version: OS X 10.4.11 and XCode 2.5!  Is that the problem?",13,21,19,2,1,A3T68OBEBCKJF7,A3E157ZN8XPUKJ,ARYGQ46IMW8AU,A2Y0ZGI29KQBTB,A872FSFU7WV6W,-0.451330793,11.2,Rude,0.242345707
092011 Stack Overflow,2640244,Storing an entire HTML page as CSV doesn't really make much sense. You mean convert an HTML table to CSV?,13,12,9,5,17,A2UFD1I8ZO1V4G,A28TXBSZPWMEU9,A1G05O3HM7DNVZ,AO3XB5I5QNNUI,A2BKPNKU3EG41Z,-0.769140247,11.2,Rude,0.211921015
092011 Stack Overflow,3764777,"@Brian useful != possible. The question was, what is possible?",9,12,13,5,17,A1BS64O3JY0YJ4,A1ZHP80O13CEUI,A28TXBSZPWMEU9,A14TK8NCD4CUN1,A17G2LOYX7WQZ,-1.087131992,11.2,Rude,0.132540112
092011 Stack Overflow,5133659,The second example in your second question accesses unallocated memory. Was that on purpose?,2,15,13,9,17,A2UME0TSE7N41G,AQRI1E9W5268O,A33SMNMTMIOJ6T,A3DKR227NQCH4X,A321FJYVTX5WP9,-0.443122925,11.2,Rude,0.566787927
092011 Stack Overflow,2549649,Delegates don't work!? Do you use Control.BeginInvoke() method to invoke delegates?,11,9,15,15,6,A1TN6BXFVYPHCB,A3EJ5TT2ZGBIDA,A1F4D2PZ7NNWTL,A39FH0T1NKKMVO,A3OY0OL2M0HUTT,-0.588498247,11.2,Rude,0.813578205
092011 Stack Overflow,6305673,"""with just an index"" to what? is this homework?",9,9,13,15,10,A2UFD1I8ZO1V4G,A1LD0QIDVO016U,A2WGBPEN45GJNF,A39FH0T1NKKMVO,A3OY0OL2M0HUTT,-0.868858367,11.2,Rude,0.475126478
092011 Stack Overflow,5465171,"So what's the question? Is it ""will you do this homework for me""?",24,6,10,12,4,A2BN0IXUJ4V01U,A33SMNMTMIOJ6T,AYG3MF094634L,A3E157ZN8XPUKJ,A14TK8NCD4CUN1,-1.822418255,11.2,Rude,0.546061546
092011 Stack Overflow,5061370,"Yeah right, I use android AsyncTask. Does it make different?",10,13,13,11,9,A2UME0TSE7N41G,A2UFD1I8ZO1V4G,A233ONYNWKDIYF,A872FSFU7WV6W,A321FJYVTX5WP9,-0.289395568,11.2,Rude,0.794170857
092011 Stack Overflow,8671616,"@Vlad: then why is there a problem? If you make each tile say 5 bytes (that 1 byte + entityID) and every entity contains it's position, then everything is O(1) right?",14,9,9,13,11,A3RP70I4XDGOIS,A150DDNTD7AMA7,A3MMLCBV2W3BP9,A14TK8NCD4CUN1,A17G2LOYX7WQZ,-0.598120865,11.2,Rude,0.855897303
092011 Bicycles,7961,"Also, that photo isn't showing up for me. Can anyone else see it?",13,12,13,9,9,AO3XB5I5QNNUI,A23312XQ2AQ91W,A28TXBSZPWMEU9,A32VJLRWGMYGSU,A2MWGIVIKOXWYM,-0.677440384,11.2,Rude,0.439137791
092011 Stack Overflow,4524418,"Looks like you're passing null to an API parameter, particularly a null Overlay somewhere in a mapview probably. How are we supposed to know?",15,10,9,13,9,A1BS64O3JY0YJ4,A1GGOZPHYU0OC0,A3MMLCBV2W3BP9,A1HBDQ0BJQBA4Q,A1CZL2FSMCKTTH,-0.468218096,11.2,Rude,0.117522555
092011 Ask Ubuntu,55061,Really annoying default behaviour. How did you disable it?,4,9,17,13,13,AYG3MF094634L,A3RLCGRXA34GC0,A3E157ZN8XPUKJ,AEPTXSWXP2AIH,A2UFD1I8ZO1V4G,-1.077456276,11.2,Rude,0.659291456
092011 Stack Overflow,4814609,"How is ""17:18:3600"" supposed to be understood? Is this a standard format?",9,14,13,15,5,A233ONYNWKDIYF,AYG3MF094634L,A28TXBSZPWMEU9,A1F4D2PZ7NNWTL,A2BKPNKU3EG41Z,-0.692455641,11.2,Rude,0.416312666
092011 Stack Overflow,6190007,What part of that are you confused about? [this](http://www.quirksmode.org/js/this.html)?,15,5,13,10,13,A33SMNMTMIOJ6T,A2OXXHGAM7B0Y,A28TXBSZPWMEU9,A3EJ5TT2ZGBIDA,A3OY0OL2M0HUTT,-0.735052718,11.2,Rude,0.346321923
092011 Stack Apps,4625,"I can't repro, have you tried decompressing the payload with gzip?  Is it valid?",9,12,13,13,9,AO3XB5I5QNNUI,A23312XQ2AQ91W,A3E157ZN8XPUKJ,A2UFD1I8ZO1V4G,A1FF4KWG1G44QE,-0.841901649,11.2,Rude,0.037861557
092011 Stack Overflow,5159746,I added commentary. Does that explain what happens now?,9,14,15,7,11,A23FB7HE970AZJ,A14TK8NCD4CUN1,A125P73OQSRNI5,A3EJ5TT2ZGBIDA,A1KC138MX47DXA,-0.842926827,11.2,Rude,0.553545617
092011 Statistical Analysis,26326,Do you really need to do it using web application?,12,9,13,11,11,A1E0EK09CA5OIO,A233ONYNWKDIYF,A3OZ8KF0HWSVWK,ARYGQ46IMW8AU,A22SZHZTF72TRM,-0.886983645,11.2,Rude,0.975862255
092011 IT Security,7198,Please describe the attacks you want to defend from. What are you seeing?,9,14,13,13,7,A233ONYNWKDIYF,A3RLCGRXA34GC0,A1VIEFZYI54JHP,A2UFD1I8ZO1V4G,ARX0S1CIDJLOX,-0.430022184,11.2,Rude,0.644632921
092011 Physics,12397,"Sorry, but I dont understand. How should I check ?",9,12,13,13,9,AO3XB5I5QNNUI,A23312XQ2AQ91W,A28TXBSZPWMEU9,A32VJLRWGMYGSU,A2MWGIVIKOXWYM,-0.699860786,11.2,Rude,0.851915874
092011 Stack Overflow,2950506,"You'll need to store something server-side. And I don't get what 'stand-alone' means in this case, how will it access the URL then?",5,11,20,8,12,A2AE4MZVUX9JPX,A2UME0TSE7N41G,A17G2LOYX7WQZ,A1F4D2PZ7NNWTL,A34M93NJC830DP,-0.516675181,11.2,Rude,0.238150495
092011 Stack Overflow,3693838,Never heard of this before. I guess you've already tried a full repair and it's still happening?,13,9,17,3,14,A2OXXHGAM7B0Y,A2YNPKYEFDZ6C9,A17G2LOYX7WQZ,A2BKPNKU3EG41Z,AP6784DKV31O6,-0.838075905,11.2,Rude,0.316717888
092011 Stack Overflow,8721571,What is the question here?  Are you wondering what you might've missed?,17,14,15,9,1,A30XX64989TZKE,A14TK8NCD4CUN1,A2BKPNKU3EG41Z,A2WGBPEN45GJNF,A3DKR227NQCH4X,-0.514837959,11.2,Rude,0.429467989
092011 Programmers,135041,"Isn't this a way to rephrase: ""Fast, Good or Cheap. Pick Two"" ?",9,17,13,5,12,A233ONYNWKDIYF,A23312XQ2AQ91W,A2UFD1I8ZO1V4G,A1FF4KWG1G44QE,A19AVMJ21AXYUM,-0.573869435,11.2,Rude,0.267039739
092011 TeX - LaTeX,8382,"I am not sure if I understand, it seems to me that your short answer contradicts your second answer. And, could you please provide an example of how can I use hyperref to do this?",5,21,9,4,17,AO3XB5I5QNNUI,A3E157ZN8XPUKJ,A28TXBSZPWMEU9,ARX0S1CIDJLOX,A13HSR88OUNIVP,-1.15590338,11.2,Rude,0.729607064
092011 Stack Overflow,5000274,"Why does transparency matter? It's just another channel, just like red, green or blue?",13,5,10,15,13,A28TXBSZPWMEU9,A3MMLCBV2W3BP9,A14TK8NCD4CUN1,A2WGBPEN45GJNF,A34M93NJC830DP,-0.725149407,11.2,Rude,0.562890262
092011 Programmers,85759,I've gotten curious about your experiences interviewing Russians. Would you go into details please?,11,11,9,13,12,AO3XB5I5QNNUI,AYG3MF094634L,A233ONYNWKDIYF,A2UFD1I8ZO1V4G,A28TXBSZPWMEU9,-0.608246352,11.2,Rude,0.612196841
092011 Android Enthusiasts,3539,"@Joel, I don't have this problem here either (Android 2.2 on HTC EVO).  Is it simply remembering a previous URL?",9,6,13,11,17,A233ONYNWKDIYF,A1KC138MX47DXA,A2UFD1I8ZO1V4G,A28TXBSZPWMEU9,A13HSR88OUNIVP,-0.981881863,11.2,Rude,0.072989253
092011 Programmers,12483,"Yeah, funny I'd write that while looking at the book.... Wasnt Mitch McConnell Pres. Bush's chief of staff?",9,13,13,9,12,A233ONYNWKDIYF,A3CPYEB0W3MLZK,A2UFD1I8ZO1V4G,A2J65ZHAJQDKAC,A2JJLF3PI5XJ0I,-0.520838936,11.2,Rude,0.144843714
092011 TeX - LaTeX,2410,Do you really need to produce separate pdf files? Maybe the `\include` and `\includeonly` features would be enough for you?,13,10,5,15,13,AO3XB5I5QNNUI,A3RLCGRXA34GC0,A3CFNUD7VR2E1E,ARYGQ46IMW8AU,A2UFD1I8ZO1V4G,-0.596836529,11.2,Rude,0.350319348
092011 Stack Overflow,4378963,what can i do about that? Make a new one??,10,7,15,9,15,A1BS64O3JY0YJ4,AL97SCCNKZILP,AYG3MF094634L,A2BKPNKU3EG41Z,A39FH0T1NKKMVO,-0.62031287,11.2,Rude,0.449568694
092011 Stack Overflow,2280739,maybe you can start with useing code tags. and i don't see how the frame loads the pics?,9,9,13,13,12,A1LZIWJ3V05K3H,A3B5ZWLZFI90WM,A1G05O3HM7DNVZ,A14TK8NCD4CUN1,A3TXO6RKFIDFUV,-0.467677129,11.2,Rude,0.221038649
092011 Stack Overflow,4121801,This has got nothing to do with any of the tags. Please can you retag appropriately if you want an answer?,13,6,16,7,14,A2UFD1I8ZO1V4G,A17G2LOYX7WQZ,A1F4D2PZ7NNWTL,A3OY0OL2M0HUTT,A1Z7WT01G55LDC,-0.942586189,11.2,Rude,0.390970454
092011 Stack Overflow,4743238,"What are you programming on, where 16MB is too much? A phone?",17,6,5,13,15,A3OW54MEVDKXJL,A2WRP1KHK1UU7L,A125P73OQSRNI5,A1M1T2EF4Y2IW8,AE68VBES5HIPY,-0.510712034,11.2,Rude,0.96216958
092011 Stack Overflow,5325984,What is `swappable` for?  Why are there no comments in your code?,9,13,13,8,13,A3HTLXAPOBCVVO,A2UFD1I8ZO1V4G,A3MMLCBV2W3BP9,A14TK8NCD4CUN1,A34M93NJC830DP,-0.750110558,11.2,Rude,0.534801147
092011 Stack Overflow,2693729,Most of time such a question is a sign of bad design. Why do you need dynamically assigned variable names?,5,9,14,17,11,A3H8M155NBFE1L,A233ONYNWKDIYF,A34NDXO56MBC3D,A3DKR227NQCH4X,A34M93NJC830DP,-0.469249436,11.2,Rude,0.845463489
092011 Stack Overflow,484206,Why do you need to do this? Why is having the row id sequential important and necessary?,16,9,16,1,14,A2OXXHGAM7B0Y,A2YNPKYEFDZ6C9,A17G2LOYX7WQZ,A2BKPNKU3EG41Z,AP6784DKV31O6,-0.841564775,11.2,Rude,0.748373878
092011 Cooking,20795,Does it have to be a vegetable? Why not some other sauce? Why not zucchini and a protein?,12,9,13,13,9,A1E0EK09CA5OIO,A233ONYNWKDIYF,A3S5L3I8O3Q2G,A3OZ8KF0HWSVWK,A309BLCQJHQULO,-0.804053174,11.2,Rude,0.83597255
092011 Stack Overflow,1144127,"I solved the problem, and I can assure you it is trivial. Is it homework or not?",13,9,5,8,21,A1BS64O3JY0YJ4,A2UFD1I8ZO1V4G,A320SR22MPGY17,AD1IH74UX9IAI,A2WGBPEN45GJNF,-0.868876663,11.2,Rude,0.391868832
092011 WordPress,14015,"Did you mean to post this answer to a different question? If not, could you please clarify how an answer about adding filters to custom post types has anything to do with using a tagging plugin?",5,9,15,18,9,A233ONYNWKDIYF,A3E157ZN8XPUKJ,A28TXBSZPWMEU9,A2MWGIVIKOXWYM,A1LRRDBA84ITCJ,-0.828417083,11.2,Rude,0.878809084
092011 Stack Overflow,3381125,Not a trivial task for homework. Did you not get any advice from the teacher on how to proceed?,17,8,10,12,9,A2UFD1I8ZO1V4G,A28TXBSZPWMEU9,A17G2LOYX7WQZ,A2BKPNKU3EG41Z,AFD31LP2ZU9G7,-0.937749757,11.2,Rude,0.779663646
092011 Statistical Analysis,3274,"So say a sample has size n = 40000.  Then you have one such sample of random variates from A, and 100 replicates each for B, C and D?",5,9,13,4,25,AO3XB5I5QNNUI,A233ONYNWKDIYF,A28TXBSZPWMEU9,A1JEXP1PJQZMTI,A2MWGIVIKOXWYM,-0.66178406,11.2,Rude,0.910588536
092011 Drupal Answers,85,"Do you mean ""What can you do with Drush that goes beyond what you can do through the Drupal web interface?"" or ""Can Drush be used for things besides Drupal?""",9,13,13,12,9,AO3XB5I5QNNUI,A1KC138MX47DXA,A2UFD1I8ZO1V4G,A1FF4KWG1G44QE,A3U7P73AIQVS9S,-0.440034959,11.2,Rude,0.718904451
092011 Stack Overflow,348362,"What exactly are you asking?  Are you asking for good examples for books to use, good things to try while learning, or just our opinion about the difficulty of examples?",10,12,12,9,13,A2TMSM19YCEXLE,A28ZB4ZB13BWAI,A39FH0T1NKKMVO,AFD31LP2ZU9G7,A3OY0OL2M0HUTT,-0.694312838,11.2,Rude,0.248882805
092011 Stack Overflow,449899,"I never understood why sun/etc didn't implement a datespan or timespan class directly.  given a Date or Timestamp class this is the first use case, isn't it?",13,13,16,5,9,A2UFD1I8ZO1V4G,A150DDNTD7AMA7,AD1IH74UX9IAI,A3DKR227NQCH4X,AFHAH1BIN51GI,-0.359125091,11.2,Rude,0.308624928
092011 Stack Overflow,3299176,Aha! Can I also give you an answer which is not coded??? You and me need codes... Okay?,17,2,8,17,12,A3OW54MEVDKXJL,A2WRP1KHK1UU7L,A125P73OQSRNI5,A1M1T2EF4Y2IW8,AE68VBES5HIPY,-0.502356808,11.2,Rude,0.063342798
092011 Stack Overflow,6490282,"What is the actual question: how to build ConnectionKit as a framework, how to use/link an arbitrary framework to a project in Xcode (which version?), or both?",8,9,5,17,17,A3RP70I4XDGOIS,ACQ5ARKNBGZKY,A872FSFU7WV6W,A2BKPNKU3EG41Z,A1Z7WT01G55LDC,-0.584965401,11.2,Rude,0.452587586
092011 Web Applications,5090,"You also seem to have 'Web' there twice. Which browser are you using, and do you have any greasemonkey scripts or plugins which may be breaking the links?",9,13,7,17,10,AO3XB5I5QNNUI,A3IS283P2CECZJ,A3RLCGRXA34GC0,A3E157ZN8XPUKJ,ARYGQ46IMW8AU,-1.229352675,11.2,Rude,0.957747987
092011 Stack Overflow,2068743,Stick it in dynamically from where? You just need it to be a global js var?,9,10,12,10,15,A233ONYNWKDIYF,A23FB7HE970AZJ,A14TK8NCD4CUN1,A3TXO6RKFIDFUV,AD1IH74UX9IAI,-0.55496247,11.2,Rude,0.055804242
092011 Stack Overflow,8130649,Why are you trying to exchange data between component in the same system via a file?  Why not use a temporary file to create a mock file?,13,9,9,12,13,A2UFD1I8ZO1V4G,A3MMLCBV2W3BP9,AO3XB5I5QNNUI,A3TXO6RKFIDFUV,A34M93NJC830DP,-0.589797265,11.2,Rude,0.849759737
