Community,Id,Request,Score1,Score2,Score3,Score4,Score5,TurkId1,TurkId2,TurkId3,TurkId4,TurkId5,Normalized Score,Average,Classification,
092011 Home Improvement,1734,It's going to depend (to a large degree I would have thought) on the climate. Where are you?,17,21,17,13,17,AO3XB5I5QNNUI,A3E157ZN8XPUKJ,A34A7196LM26TV,A32VJLRWGMYGSU,A3U7P73AIQVS9S,0.608886645,17,Polite,0.294927551
092011 Stack Overflow,5973810,Please provide code and a specific question. What have you tried?,21,11,15,17,21,ACQ5ARKNBGZKY,A3DGKW5JY87RCH,A39FH0T1NKKMVO,A2GSW5RBAT5LQ5,AFHAH1BIN51GI,1.096196242,17,Polite,0.942418033
092011 Stack Overflow,1410875,What is a string pointer? Can you give some example about the input and the expected output?,20,13,18,21,13,A3R637QBE0IXDF,A14TK8NCD4CUN1,A17G2LOYX7WQZ,AFD31LP2ZU9G7,A34M93NJC830DP,0.574115741,17,Polite,0.119216643
092011 GIS,5805,"so the airport is in one feature class, and the destination in another feature class? You wish to join all airports to all destinations?",21,17,21,13,13,A3E157ZN8XPUKJ,A2UFD1I8ZO1V4G,A771BLWJLMWYY,A28TXBSZPWMEU9,A2MWGIVIKOXWYM,0.434509003,17,Polite,0.752087729
092011 English Language and Usage,72397,"Sorry, just realized you were talking specifically about using the word in the title, which does make things a little trickier-- you probably don't want your app to have a different name on both sides of the pond, although it wouldn't be unheard of. Can't you just use ""Plane"" instead? :P",13,17,15,21,19,AO3XB5I5QNNUI,ARYGQ46IMW8AU,A28TXBSZPWMEU9,A32VJLRWGMYGSU,ARX0S1CIDJLOX,0.769977814,17,Polite,0.384783017
092011 Stack Overflow,4101786,"If there are duplicate items in the trees, should the duplicates be merged or not?  For example, if the trees are [1,2,3,4] and [1,2,5] should the result be [1,1,2,2,3,4,5] or [1,2,3,4,5]?",13,25,17,17,13,A2UFD1I8ZO1V4G,ARJ44YPGA2FPK,A150DDNTD7AMA7,A3OW54MEVDKXJL,A3MMLCBV2W3BP9,0.545639495,17,Polite,0.44263463
092011 Stack Overflow,8702346,"When you say ""non-overlapping polygons,"" what happens if you have edges that describe two overlapping polygons?  Do you report that as one polygon consisting of their intersection, or do you report neither of them?",21,14,21,16,13,A3H8M155NBFE1L,A28TXBSZPWMEU9,A320SR22MPGY17,A39FH0T1NKKMVO,A34M93NJC830DP,0.65689607,17,Polite,0.506855659
092011 Stack Overflow,5116374,"Windows, Python 2.6, Cython 0.14, Gcc 4.5.1. Could you post your 2d code?",17,20,15,16,17,A233ONYNWKDIYF,A17G2LOYX7WQZ,A1F4D2PZ7NNWTL,AP6784DKV31O6,A38EGQEYZHRQNC,0.529990745,17,Polite,0.967953563
092011 Stack Overflow,6625274,"do they have to be executables? what about MEF and doing the apps as plugins for the ""launcher""?",20,21,14,13,17,A2TMSM19YCEXLE,A3E157ZN8XPUKJ,A14TK8NCD4CUN1,AO3XB5I5QNNUI,AFHAH1BIN51GI,0.433404326,17,Polite,0.140581518
092011 Stack Overflow,7439437,"Another idea, looks like you are using `MBProgressHUD`, I guess your code is triggered from an animation callback, from memory, I think CoreData is not multi-threading safe. Try not to do this from `MBProgressHUD` or try using `performSelectorOnMainThread` maybe?",17,17,17,17,17,A3H8M155NBFE1L,A2UFD1I8ZO1V4G,A1KC138MX47DXA,AD1IH74UX9IAI,A3OY0OL2M0HUTT,0.606893134,17,Polite,0.713445245
092011 Electrical Engineering,30818,"@Russell - 30 pages is a lot, and I guess it will have some noise in it too. Can't you just post the gist of it here?",13,19,21,17,15,A2PXJTMWGUE5DC,A13CO3B2BRXQLZ,A3E157ZN8XPUKJ,A3JBAUWN5T7E0Q,ARYGQ46IMW8AU,0.735610487,17,Polite,0.807680261
092011 Stack Overflow,8567115,@luser droog: I can surely try! where can I look at that source?,21,5,20,14,25,A1ZHP80O13CEUI,A2RDZ580VXUO1X,A17G2LOYX7WQZ,A34M93NJC830DP,A38EGQEYZHRQNC,0.923682265,17,Polite,0.002825548
092011 Bicycles,2993,great points.  Just out of curiosity is there a reason that you would prefer steel over aluminum or are you just commenting that it would probably hold up well?,16,9,22,21,17,A1E0EK09CA5OIO,A233ONYNWKDIYF,A3OZ8KF0HWSVWK,ARYGQ46IMW8AU,A309BLCQJHQULO,0.46892543,17,Polite,0.381230066
092011 WordPress,12491,I don't quite understand the question. You want a plugin that inserts custom templates defined in plugin?,9,21,13,21,21,AO3XB5I5QNNUI,A3E157ZN8XPUKJ,A28TXBSZPWMEU9,ARX0S1CIDJLOX,A13HSR88OUNIVP,0.222035405,17,Polite,0.450983537
092011 Stack Overflow,5249549,"With the detail you've given that sounds OK to me, though you should note that MAC addresses can be changed/spoofed, so I guess it's a risk based on how tech-savvy/desperate your client is.

If you trust your clients anyway, why not just use an ""honesty"" approach where they tell you how many times they have it installed and pay the correct fee?",17,21,13,17,17,A2UFD1I8ZO1V4G,ARJ44YPGA2FPK,A150DDNTD7AMA7,A3OW54MEVDKXJL,A3MMLCBV2W3BP9,0.776443714,17,Polite,0.940231329
092011 Stack Overflow,6377576,Try to add an `import pycuda` line at the top of your script. Does it help?,17,17,17,17,17,A2NPNKSW89BODS,A2PXJTMWGUE5DC,A2UFD1I8ZO1V4G,A1F4D2PZ7NNWTL,A3TXO6RKFIDFUV,1.17506672,17,Polite,0.970275793
092011 Stack Overflow,3856737,For what its worth I have chrome 7. Is it possible that greasemonkey support was added at 7?,13,17,21,14,20,A1BS64O3JY0YJ4,A2UFD1I8ZO1V4G,APEJ17EE0VDDT,A14TK8NCD4CUN1,A17G2LOYX7WQZ,0.673850739,17,Polite,0.901426488
092011 Theoretical Computer Science,7560,"@Mike Chen Could you, please, explain what is $C_=P$? And what do you mean by the ""counting of topological sorts""?",16,21,13,22,13,A3RLCGRXA34GC0,A3E157ZN8XPUKJ,A2UFD1I8ZO1V4G,A1FF4KWG1G44QE,A3GOI327COFGY5,0.473115548,17,Polite,0.98022303
092011 Stack Overflow,4782043,"2.1. looks like it is testing that pj is in the ""interior"" of the convex angle defined by pi-1, pi, pi+1. In that case, can't 2.2. be modified so that it tests that pj is in the ""exterior"" of the convex angle defined by pi+1, pi, pi-1?",13,21,13,17,21,A233ONYNWKDIYF,A3E157ZN8XPUKJ,A28TXBSZPWMEU9,A17G2LOYX7WQZ,A3DKR227NQCH4X,0.284415333,17,Polite,0.719482261
092011 Stack Overflow,4369197,"I'm not sure what the distinction is that you're making. What do you want to store, and how do you want to retrieve it?",17,21,17,17,13,A1KYGP10BH4FXU,A1H0XDGVSBL152,A872FSFU7WV6W,A3DKR227NQCH4X,A3OY0OL2M0HUTT,0.98816695,17,Polite,0.380133909
092011 Programmers,185951,"Thanks for the reply. Could you please elloborate on ""long as you keep the dependencies clean (no cycles) and you already know where to cut to divide "" prob with an example?",14,17,17,16,21,A3RLCGRXA34GC0,A3E157ZN8XPUKJ,A2UFD1I8ZO1V4G,A28TXBSZPWMEU9,A13HSR88OUNIVP,0.491266137,17,Polite,0.8093897
092011 Stack Overflow,1729856,Is the italicized text the only error you get or are you getting any other errors?  Or are your breakpoints just not being triggered?,13,15,19,21,17,A233ONYNWKDIYF,A14TK8NCD4CUN1,A17G2LOYX7WQZ,A1KC138MX47DXA,A3OY0OL2M0HUTT,0.627112172,17,Polite,0.535543817
092011 Stack Overflow,4932175,"OS?  OpenGL implementation vendor?  Can you post a complete, minimal program that demonstrates the problem?",13,19,16,16,21,A3MMLCBV2W3BP9,A17G2LOYX7WQZ,A2BKPNKU3EG41Z,A1HBDQ0BJQBA4Q,A312BVGKE6BAS5,0.609697539,17,Polite,0.89639558
092011 Stack Overflow,5520051,The result you're getting is odd. Can you please post more information?,17,12,13,22,21,AQRI1E9W5268O,A14TK8NCD4CUN1,AO3XB5I5QNNUI,A3EJ5TT2ZGBIDA,A3DKR227NQCH4X,0.715613505,17,Polite,0.035287627
092011 Programmers,15220,"Should be ""expect"" instead of ""respect"". And also, please see my added question ""Do I have to know about Escher and Bach?""",13,17,17,21,17,AO3XB5I5QNNUI,AYG3MF094634L,A233ONYNWKDIYF,A32VJLRWGMYGSU,AI4WWBB2PNCKH,0.967634267,17,Polite,0.86303057
092011 Stack Overflow,8511539,"What happens when you run this under debugging, and what's your configuration? Can you show me the first part of the packages file it creates?",17,14,16,17,21,A2UFD1I8ZO1V4G,AQRI1E9W5268O,A2OXXHGAM7B0Y,A233ONYNWKDIYF,A3E157ZN8XPUKJ,0.770034613,17,Polite,0.93988749
092011 Stack Overflow,4157265,It doesn't look like a Rails method. Perhaps some gem or plugin that does this?,21,17,21,13,13,A3FHCACAJU25J6,A2AE4MZVUX9JPX,A17NUCNTE4BJK6,A3TXO6RKFIDFUV,A2WGBPEN45GJNF,0.378420866,17,Polite,0.082239101
092011 Stack Overflow,3308973,"To answer your last question, you want to use `extern ""C""` to prevent the name-mangling. Not sure about the first one yet though; have you verified that you're actually being sent any messages?",17,17,14,18,19,A2UFD1I8ZO1V4G,A2YNPKYEFDZ6C9,A14TK8NCD4CUN1,A17G2LOYX7WQZ,A2GRSJHXTR7JQR,0.964123404,17,Polite,0.077693017
092011 Stack Overflow,6786467,What exactly fails? What error are you getting?,15,15,20,18,17,A1C9RMT7PMKWVA,ARYGQ46IMW8AU,A3EJ5TT2ZGBIDA,A17G2LOYX7WQZ,A2BKPNKU3EG41Z,0.603887083,17,Polite,0.31645427
092011 Stack Overflow,5816169,"Meant to ask -- what do you mean by whether the JVM can remember the order of the nodes? If you use a List, isn't it the JVM implementing the list for you?",17,13,17,17,21,A2UFD1I8ZO1V4G,A150DDNTD7AMA7,AD1IH74UX9IAI,A3DKR227NQCH4X,AFHAH1BIN51GI,0.763120341,17,Polite,0.034152135
092011 TeX - LaTeX,1537,"The link you gave isn't a repository, but a page with links to the repositories for various fedora versions. Did you try those links, or did you somehow try to use the link you gave as though it was the repository?",13,21,21,13,17,A233ONYNWKDIYF,A23312XQ2AQ91W,A3E157ZN8XPUKJ,A2UFD1I8ZO1V4G,A1XKHXJ8CMIX7N,0.508804117,17,Polite,0.540546124
092011 Stack Overflow,7567064,"if you mean _window.onload = onload_, then that would work, or something similar.  have you tried your example to see what happens?",21,13,13,17,21,A3R637QBE0IXDF,A233ONYNWKDIYF,A28TXBSZPWMEU9,AP6784DKV31O6,A3DKR227NQCH4X,0.456258329,17,Polite,0.952322259
092011 TeX - LaTeX,17545,"Could you please check the solutions for hyperref? Also, how can I put something (one time only) that is formatted like a chapter* in the toc, but without the page number?",17,16,17,21,14,AO3XB5I5QNNUI,A3RLCGRXA34GC0,A3CPYEB0W3MLZK,ARYGQ46IMW8AU,AKWJ5294VIZRR,0.690872692,17,Polite,0.6454904
092011 Stack Overflow,3678903,"Depends on your OS. Are you on Linux, Mac, Windows?",13,17,16,18,21,A1ZHP80O13CEUI,ARYGQ46IMW8AU,A1F4D2PZ7NNWTL,AD1IH74UX9IAI,A3OY0OL2M0HUTT,0.74755431,17,Polite,0.938468358
092011 Stack Overflow,1200852,Needs more context. Can you provide the question which precedes the answer too?,15,17,15,21,17,A3RP70I4XDGOIS,A2UFD1I8ZO1V4G,A14TK8NCD4CUN1,A872FSFU7WV6W,A3OY0OL2M0HUTT,0.937242836,17,Polite,0.087222382
092011 Stack Overflow,5897984,How do you define minimal? The minimum number of movements or the minimum of the sum of distances/squares of the distances?,21,17,14,18,15,A3E157ZN8XPUKJ,A14TK8NCD4CUN1,A3EJ5TT2ZGBIDA,A2BKPNKU3EG41Z,AP6784DKV31O6,0.56772515,17,Polite,0.967803343
092011 Electrical Engineering,19559,"@Jaroslav: Sorry, I checked the linked page and didn't see anything obvious. Do you thing that replacing the $*$ with $\cdot$ would be ok?",13,17,14,20,21,AO3XB5I5QNNUI,A3E157ZN8XPUKJ,A28TXBSZPWMEU9,ARX0S1CIDJLOX,A13HSR88OUNIVP,0.30602195,17,Polite,0.40149636
092011 Theoretical Computer Science,272,"One-way permutations are believed to exist (e.g., RSA).  I suppose you are looking for negative results?",14,19,18,21,13,A3RLCGRXA34GC0,A23312XQ2AQ91W,A3CFNUD7VR2E1E,A3E157ZN8XPUKJ,A28TXBSZPWMEU9,0.576585722,17,Polite,0.634874247
092011 WordPress,11632,"You ask about a ""tag"". Is that tag from Wordpress or does the NextGEN gallery has it's own tagging mechanism?",17,21,17,13,17,A233ONYNWKDIYF,A23312XQ2AQ91W,ARYGQ46IMW8AU,A2UFD1I8ZO1V4G,A32VJLRWGMYGSU,0.638828191,17,Polite,0.997279456
092011 Stack Overflow,8614440,have you tried any other patchlevel of 1.8.7 ? ruby-1.8.7-p352 for example ?,15,17,13,19,21,A2AE4MZVUX9JPX,A3OW54MEVDKXJL,A3MMLCBV2W3BP9,A2BKPNKU3EG41Z,A3DKR227NQCH4X,0.660732698,17,Polite,0.6173027
092011 Web Applications,13869,"Nice! Can we get this for our Stack Overflow profiles, please?",15,21,13,15,21,A3RLCGRXA34GC0,A3E157ZN8XPUKJ,A2UFD1I8ZO1V4G,A28TXBSZPWMEU9,ARX0S1CIDJLOX,0.566292368,17,Polite,0.2114032
092011 GIS,4115,It looks like it may be an artifact of JPEG compression.  Does the same problem occur with lossless formats such as TIFF or PNG24?,17,15,15,17,21,AO3XB5I5QNNUI,A3RLCGRXA34GC0,A3CPYEB0W3MLZK,ARYGQ46IMW8AU,AKWJ5294VIZRR,0.742519063,17,Polite,0.035401915
092011 Stack Overflow,682404,"Am I correct in thinking that you only are interested in paths having minimum edge count across all paths?  I.e. if there exists a path with weights (2, 2, 2), you're not interested in the path (5, 6, 7, 8), right?",20,13,17,14,21,A3VJDU2VRMN05L,A233ONYNWKDIYF,A1F4D2PZ7NNWTL,A2BKPNKU3EG41Z,A2GRSJHXTR7JQR,1.14792762,17,Polite,0.353094819
092011 Unix and Linux,12545,"@forcefsck I tried the exact steps as outlined in the answer, but got an error from Grub saying ""could not find device for /boot: Not found or not a block device."". Please see the screenshots of it and my /etc/fstab, any other ideas?",17,9,21,17,21,AO3XB5I5QNNUI,A2AMGE57IJVSHF,A3E157ZN8XPUKJ,A3CPYEB0W3MLZK,A2MWGIVIKOXWYM,0.481514602,17,Polite,0.918003339
092011 Programmers,6322,Excellent question. Can we get som esources as to where the different styles originated?,13,17,21,13,21,AYG3MF094634L,A233ONYNWKDIYF,A3E157ZN8XPUKJ,A2UFD1I8ZO1V4G,ARX0S1CIDJLOX,0.538083485,17,Polite,0.571239883
092011 Stack Overflow,3389098,"I think `chunklen` needs to also be able to decrease, or else your queue will have size proportional to its largest-ever size even if it is empty.  So how about `if (q->head->next == q->tail) chunklen/=2`?",13,17,17,21,17,ARYGQ46IMW8AU,A2OTEOJC764LEP,AO3XB5I5QNNUI,A1TWD4UTLWVYAQ,A1Z7WT01G55LDC,0.441154416,17,Polite,0.765105549
092011 Electrical Engineering,9903,"I know, but your question implied that you have conductive tape and want to know if it is conductive. Another good question might be, Is there a conductive tape product and then have details in the question about what you need specifically?",17,21,17,13,17,A233ONYNWKDIYF,A23312XQ2AQ91W,ARYGQ46IMW8AU,A2UFD1I8ZO1V4G,A32VJLRWGMYGSU,0.638828191,17,Polite,0.661838168
092011 Drupal Answers,4563,Interesting question. Are you after a theoretical discussion or is there a specific problem you're trying to solve?,17,17,13,21,17,AO3XB5I5QNNUI,A233ONYNWKDIYF,A2UFD1I8ZO1V4G,ARX0S1CIDJLOX,AI4WWBB2PNCKH,0.872628321,17,Polite,0.02053075
092011 Drupal Answers,3536,"Are you sure to have more than 4 images/node? Also, are you the one behind http://www.drupality.be?",21,22,17,12,13,A3E157ZN8XPUKJ,A28TXBSZPWMEU9,A32VJLRWGMYGSU,A2JJLF3PI5XJ0I,A1LRRDBA84ITCJ,0.831676161,17,Polite,0.743988548
092011 WordPress,11214,"sorry my bad english , its not what i ws looking for becuase everything i would have to include a shortcode after more tag in the post editor, but it can do that work. So its not possible to just work on some function which will automatically put some text/code after the more tag in the post page ?",17,21,13,21,13,AO3XB5I5QNNUI,A3E157ZN8XPUKJ,A2UFD1I8ZO1V4G,ALK595458N4IR,A3GOI327COFGY5,0.485702745,17,Polite,0.937368305
092011 Home Improvement,8729,"I would love to see the results of any study demonstrating degradation in signal quality over time through speaker cable. Over very long periods of time I could see this being possible, but really?",21,13,21,13,17,A3E157ZN8XPUKJ,A2UFD1I8ZO1V4G,A771BLWJLMWYY,A28TXBSZPWMEU9,A32VJLRWGMYGSU,0.268219493,17,Polite,0.889175412
092011 Physics,10166,What do you mean with thickness? Moduli?,17,17,17,21,13,AO3XB5I5QNNUI,A233ONYNWKDIYF,A23312XQ2AQ91W,A3E157ZN8XPUKJ,A2MWGIVIKOXWYM,0.54021648,17,Polite,0.44026286
092011 English Language and Usage,740,"Shouldn't it be then reasonable to expect you to ask how are you DOING? / I'm doing good, instead of how are you?",13,13,21,13,25,AO3XB5I5QNNUI,A233ONYNWKDIYF,A3CFNUD7VR2E1E,A3CPYEB0W3MLZK,ARX0S1CIDJLOX,0.894700301,17,Polite,0.152786272
092011 Stack Overflow,6246600,"Do you know anything about the contents of the strings?  Are they ASCII, for example?",17,19,17,15,17,A3OW54MEVDKXJL,A125P73OQSRNI5,AD1IH74UX9IAI,A39FH0T1NKKMVO,A321FJYVTX5WP9,0.776901976,17,Polite,0.667792497
092011 Drupal Answers,3519,"Which is the plain text field you are referring to? Is it a field you added, or is it added from a third-party module?",21,13,15,15,21,A3E157ZN8XPUKJ,A1KC138MX47DXA,ARYGQ46IMW8AU,A28TXBSZPWMEU9,A13HSR88OUNIVP,0.2214389,17,Polite,0.849873161
092011 Home Improvement,10020,"before I compose my answers to your questions, could you please explain what you mean by *""Lay a new thin layer of **gyps** (or some other material)""?* Also, would you be opposed to the new ""concrete"" screed layer being your finished balcony surface?",17,21,21,13,13,AO3XB5I5QNNUI,A233ONYNWKDIYF,A3E157ZN8XPUKJ,A2UFD1I8ZO1V4G,A28TXBSZPWMEU9,0.673550669,17,Polite,0.629384357
092011 Stack Overflow,3395753,"Thanks for the pointer, but now I am not sure to understand your problem. Could you add a drawing?",19,21,9,15,21,A2UME0TSE7N41G,A3E157ZN8XPUKJ,A3OW54MEVDKXJL,A14TK8NCD4CUN1,A125P73OQSRNI5,0.85250294,17,Polite,0.948460124
092011 Stack Overflow,4673992,"But the line with `""ClipID""` works? (Also, can you try `var title = element.getElementsByTagName(""Title"")[0];` instead?)",13,20,16,15,21,A2UFD1I8ZO1V4G,A1KC138MX47DXA,AD1IH74UX9IAI,A2BKPNKU3EG41Z,A38EGQEYZHRQNC,0.315966014,17,Polite,0.114751419
092011 Stack Overflow,1348893,Please clarify your question a bit. Are you just asking how to invoke an instance's methods?,16,13,21,20,15,A29OF3N57XNRZ0,A233ONYNWKDIYF,A2TK0FA154PHP0,A2Y0ZGI29KQBTB,A1F4D2PZ7NNWTL,0.598133622,17,Polite,0.638386338
092011 Physics,17773,"@Sklivvz I'd recommend to edit the headline. As it is, and taken wordly, the only answer is: ""Of course, what else?""",9,17,17,17,25,A2TVQMMI5TNQPJ,A3RLCGRXA34GC0,A2UFD1I8ZO1V4G,A32VJLRWGMYGSU,A1FF4KWG1G44QE,0.71687551,17,Polite,0.058176051
092011 Stack Overflow,5946871,What is the pixel size of your JPEG file? Of the generated icon?,13,17,13,21,21,A33SMNMTMIOJ6T,A1F4D2PZ7NNWTL,A2WGBPEN45GJNF,A3DKR227NQCH4X,A38EGQEYZHRQNC,0.343882389,17,Polite,0.402380226
092011 Android Enthusiasts,5955,You'd probably get better answers at Stack Overflow. Can you elaborate what you're trying to do?,13,18,20,13,21,A233ONYNWKDIYF,A23312XQ2AQ91W,A1KQ5WV7BT3QAS,A28TXBSZPWMEU9,A13HSR88OUNIVP,0.37562152,17,Polite,0.472835745
092011 Unix and Linux,19203,Your question is unclear. Could you please edit the question to more fully describe what you are trying to accomplish and what your different scenarios are?,21,21,17,13,13,A233ONYNWKDIYF,A1HUUSCZ4I5SOP,A23312XQ2AQ91W,A2UFD1I8ZO1V4G,A3S5L3I8O3Q2G,0.585625713,17,Polite,0.961594633
092011 TeX - LaTeX,29625,I don't understand your question. Can you please elaborate and clarify a little more?,17,18,13,15,22,AO3XB5I5QNNUI,A3CFNUD7VR2E1E,A2UFD1I8ZO1V4G,A28TXBSZPWMEU9,A13HSR88OUNIVP,0.69195664,17,Polite,0.922974461
092011 Unix and Linux,7718,"For those of us who aren't specifically familiar with `sendmail`, it might help if you post a more complete set of log lines, and describe exactly what details you're paying attention to when you do this manually.  For example, in the line you've posted, is `p937blksdh3` the message-id?",21,17,17,21,9,A23312XQ2AQ91W,A2UFD1I8ZO1V4G,A32VJLRWGMYGSU,A1W2G1N4BDF2DW,A1LRRDBA84ITCJ,0.488691089,17,Polite,0.267345749
092011 GIS,381,What country are you interested in? did you want to restrict to road routing?,13,21,17,13,22,AO3XB5I5QNNUI,A3E157ZN8XPUKJ,ARYGQ46IMW8AU,A28TXBSZPWMEU9,A13HSR88OUNIVP,0.346944201,17.2,Polite,0.13075338
092011 Stack Overflow,165590,I'm not quite sure what you are trying to achieve. Do you want the background image to change only when you hover over the corners?,25,10,15,18,18,A1133ON5ALJKXJ,A23FB7HE970AZJ,A28TXBSZPWMEU9,A17G2LOYX7WQZ,A1Z7WT01G55LDC,0.55352951,17.2,Polite,0.85145232
092011 Stack Overflow,6580562,"agreed, but i am not seeing the checkbox. are you able to wiki-fy it? thx",21,21,15,16,13,A3E157ZN8XPUKJ,A2Y0ZGI29KQBTB,A14TK8NCD4CUN1,A3EJ5TT2ZGBIDA,A34M93NJC830DP,0.568246861,17.2,Polite,0.893257803
092011 Stack Overflow,4971262,"Out of curiosity, why would a user choose to disable multitasking (i.e. what's the tradeoff)?",17,21,17,17,14,A2UFD1I8ZO1V4G,A3MMLCBV2W3BP9,AO3XB5I5QNNUI,A3TXO6RKFIDFUV,A34M93NJC830DP,1.238473096,17.2,Polite,0.487742843
092011 Stack Overflow,5786419,"Did you try writing something in an attempt to implement this? If so, what happens when you run it?",21,17,14,19,15,A2RDZ580VXUO1X,A1G05O3HM7DNVZ,A14TK8NCD4CUN1,A17G2LOYX7WQZ,A1F4D2PZ7NNWTL,0.660666761,17.2,Polite,0.966478082
092011 Stack Overflow,5131001,"Yes, that is the real source code. And the compilation has been performed without optimization, perhaps that is the reason?",16,20,20,17,13,A3RP70I4XDGOIS,A2AE4MZVUX9JPX,A28TXBSZPWMEU9,A28ZB4ZB13BWAI,AO3XB5I5QNNUI,1.404712944,17.2,Polite,0.718406966
092011 Stack Overflow,3035617,Is the crop operation cheap? If you already have the image on disk you could just pass the XML filename and the crop parameters into the .ashx as a query string and do the crop again in the .ashx?,13,17,20,16,20,A33SMNMTMIOJ6T,A1M1T2EF4Y2IW8,A1KC138MX47DXA,A2BKPNKU3EG41Z,A2WGBPEN45GJNF,0.596481123,17.2,Polite,0.42072522
092011 Stack Overflow,3679587,"So you mean you just can't use date functions, yes? Presumably comparison, multiplication and subtraction are okay? :-)",21,17,19,20,9,A2X9AEDAHF7O7S,AQRI1E9W5268O,A2OXXHGAM7B0Y,A150TBAWIYV8J4,A312BVGKE6BAS5,1.010896382,17.2,Polite,0.808032713
092011 Stack Overflow,5690605,"I have a question about this topic. Consider the general component diagram, not the instances one: should we draw two sockets (connection) from the philosopher to the dining room / fork interface or is one enough?",21,16,17,17,15,A3E157ZN8XPUKJ,A14TK8NCD4CUN1,A3EJ5TT2ZGBIDA,A2BKPNKU3EG41Z,AP6784DKV31O6,0.615442123,17.2,Polite,0.88161156
092011 Stack Overflow,6388598,Nice.  What kind of improvement?,14,17,18,18,19,A1133ON5ALJKXJ,A23FB7HE970AZJ,A28TXBSZPWMEU9,A17G2LOYX7WQZ,A1Z7WT01G55LDC,0.888463909,17.2,Polite,0.358725106
092011 Ask Ubuntu,48390,Where is this dead zone? Can you please update your question with a screenshot?,16,19,25,13,13,AYG3MF094634L,A23312XQ2AQ91W,A1KC138MX47DXA,A2UFD1I8ZO1V4G,A29B522D0BX6HN,0.722335092,17.2,Polite,0.302318383
092011 English Language and Usage,68214,"Please can you add more information as to what you want ""inner protected world"" to mean? are we talking about a ring of planets, some sort of mental sanctum, or something interdimensional, or something completely other?",9,17,18,21,21,AO3XB5I5QNNUI,A3RLCGRXA34GC0,A23312XQ2AQ91W,A1LRRDBA84ITCJ,A13HSR88OUNIVP,0.637900366,17.2,Polite,0.932500211
092011 Stack Overflow,5290594,convert it to float?  Catch the error and report to the user?,21,21,11,20,13,A3E157ZN8XPUKJ,AGFHIO3UKJ9EF,A14TK8NCD4CUN1,A17G2LOYX7WQZ,A1GK3MPU2HL0C8,0.35662168,17.2,Polite,0.192960941
092011 Stack Overflow,8167554,"I had really hoped to get some more opinions on this question. I modified it a bit, possibly vote to reopen?",18,17,21,13,17,A2WKPCZU4U110T,A2PXJTMWGUE5DC,A1GGOZPHYU0OC0,A28TXBSZPWMEU9,A1Z7WT01G55LDC,1.060704614,17.2,Polite,0.349300297
092011 English Language and Usage,6493,+1 ... even though I know where it comes from - see the mmyers answer - i've always wondered why it's considered so compelling. Can anyone add to the mmyers answer and explain?,21,21,17,11,16,A26PVQXPVF93M0,A3E157ZN8XPUKJ,A3CPYEB0W3MLZK,A28TXBSZPWMEU9,ARX0S1CIDJLOX,0.152511275,17.2,Polite,0.464509233
092011 Stack Overflow,4489740,What kind of processing will you perform?  Is it just a matter of setting up data structures to model a family tree?,21,17,18,17,13,A3E157ZN8XPUKJ,A125P73OQSRNI5,A3EJ5TT2ZGBIDA,AD1IH74UX9IAI,A150TBAWIYV8J4,0.569987288,17.2,Polite,0.648875124
092011 Stack Overflow,3589275,"Are you looking to change the text field's height (if so, why?), or keep its height the same while resizing the window?",17,21,15,17,16,A1LZIWJ3V05K3H,A3E157ZN8XPUKJ,A14TK8NCD4CUN1,A125P73OQSRNI5,A39FH0T1NKKMVO,0.556680556,17.2,Polite,0.069624132
092011 Stack Overflow,1829971,how are they going to be used/accessed?  through a bespoke app or what?,19,20,13,14,20,A3R637QBE0IXDF,A3E157ZN8XPUKJ,A3OZ8KF0HWSVWK,AP6784DKV31O6,A1Z7WT01G55LDC,0.239622124,17.2,Polite,0.876904387
092011 Webmasters,7109,This doesn't really make any sense. Are the word documents going to be downloaded from links on the site or do they just contain text FOR the site?,17,13,22,13,21,AO3XB5I5QNNUI,A233ONYNWKDIYF,A1FF4KWG1G44QE,A1LRRDBA84ITCJ,A13HSR88OUNIVP,0.456636965,17.2,Polite,0.741317524
092011 Stack Overflow,8550923,Found some more information which likely explains it: http://rt.openssl.org/Ticket/Display.html?id=1497&user=guest&pass=guest -- still not sure how I can work around it. Maybe `keytool` can be used instead?,13,16,20,16,21,A2UFD1I8ZO1V4G,A3EJ5TT2ZGBIDA,A17G2LOYX7WQZ,A2BKPNKU3EG41Z,A1Z7WT01G55LDC,0.425622713,17.2,Polite,0.383604539
092011 Stack Overflow,5915849,@spinning_plate - These are useful links. Do you know by any chance if parallelizing the computation will speed up the processing and if so how can a graph traversal problem like this be broken down into smaller pieces computable on numerous machines?,19,19,14,21,13,ARYGQ46IMW8AU,A28ZB4ZB13BWAI,A14TK8NCD4CUN1,AO3XB5I5QNNUI,A34M93NJC830DP,1.297206488,17.2,Polite,0.823005937
092011 Stack Overflow,5113031,"Please edit your question and explain what isn't working. What errors are you seeing, or how isn't it working as you expect?",17,16,16,24,13,A3MMLCBV2W3BP9,A17G2LOYX7WQZ,A2BKPNKU3EG41Z,A1HBDQ0BJQBA4Q,A312BVGKE6BAS5,0.859377187,17.2,Polite,0.645902462
092011 Unix and Linux,109,What FTP software are you use? What authentication methods?,21,17,13,19,16,A3E157ZN8XPUKJ,A2UFD1I8ZO1V4G,A771BLWJLMWYY,A28TXBSZPWMEU9,A2MWGIVIKOXWYM,0.65962268,17.2,Polite,0.337939013
092011 Stack Overflow,7719531,"im curious, why did you choose to use malloc()/free() inside the class instead of new/delete? also, what is your compiler?",15,17,19,16,19,A33SMNMTMIOJ6T,A1M1T2EF4Y2IW8,A1KC138MX47DXA,A2BKPNKU3EG41Z,A2WGBPEN45GJNF,0.620369943,17.2,Polite,0.156442431
