Community,Id,Request,Score1,Score2,Score3,Score4,Score5,TurkId1,TurkId2,TurkId3,TurkId4,TurkId5,Normalized Score,Average,Classification,
092011 Stack Overflow,7761899,"I think, the point here is I should have checked for error when i am doing ""ptr[0] = new char[strlen(psError) + 1];""

This might be the reason that it is throwing error when i am trying to delete it later?",17,14,15,17,17,A2UFD1I8ZO1V4G,A33SMNMTMIOJ6T,A39FH0T1NKKMVO,A312BVGKE6BAS5,A28WCYNS229OHH,0.655080864,16,Polite,0.371410781
092011 Stack Overflow,6009803,Does your project involve some graphical user interface? What do you want to code?,17,13,17,15,18,A2UFD1I8ZO1V4G,A3MMLCBV2W3BP9,APWXTMJO1I1ST,A2BKPNKU3EG41Z,A2WGBPEN45GJNF,0.519397729,16,Polite,0.295406832
092011 Stack Overflow,3377749,"It's not clear what you're trying to do here.  Do you want the view to render the string ""1 image more than 1 image ... ""?",17,13,15,22,13,A2UFD1I8ZO1V4G,A233ONYNWKDIYF,A125P73OQSRNI5,A1TWD4UTLWVYAQ,A2PIUQICBRBZZY,0.560973735,16,Polite,0.821629223
092011 Gaming,10182,you're twisted. Do you publish a newsletter to which I could subscribe?,13,21,20,13,13,A233ONYNWKDIYF,A1HUUSCZ4I5SOP,A23312XQ2AQ91W,A2UFD1I8ZO1V4G,A3S5L3I8O3Q2G,0.311801773,16,Polite,0.051242655
092011 Stack Overflow,5405211,"So, you essentially want to fetch most frequent words from the text. Is that correct?",17,17,13,15,18,A2UFD1I8ZO1V4G,A1H0XDGVSBL152,A233ONYNWKDIYF,A3E157ZN8XPUKJ,A17G2LOYX7WQZ,0.434452933,16,Polite,0.85789568
092011 Webmasters,5515,"Perhaps there's an error in your sitemap, but I can't see, because Stackoverflow blocks sitemap access to non-search-engines.  Could you add the relevant snippet from your sitemap to the question?",17,13,19,18,13,AO3XB5I5QNNUI,A3RLCGRXA34GC0,A23312XQ2AQ91W,A1KC138MX47DXA,A2UFD1I8ZO1V4G,0.390479307,16,Polite,0.333605586
092011 Stack Overflow,8318974,Is it the only code or did you cut this out of a bigger context? If so: could it be that in the bigger context one of your variables is shadowed by a local?,21,13,9,21,16,A3E157ZN8XPUKJ,A1G05O3HM7DNVZ,A2WRP1KHK1UU7L,A2WGBPEN45GJNF,A39FH0T1NKKMVO,0.33236779,16,Polite,0.891226385
092011 Stack Overflow,4311266,What approaches did you try? What were the problems?,13,15,19,14,19,A1ZHP80O13CEUI,A28TXBSZPWMEU9,A3SMTP08PPXDWA,A14TK8NCD4CUN1,A2WGBPEN45GJNF,0.744877627,16,Polite,0.60068518
092011 Cooking,2773,"are we talking biscuits, as in the fluffy, flaky southern U.S. food or cookies?",9,16,21,9,25,AO3XB5I5QNNUI,AYG3MF094634L,A3E157ZN8XPUKJ,A32VJLRWGMYGSU,A2MWGIVIKOXWYM,0.084132444,16,Polite,0.271248753
092011 IT Security,5714,"I'm following through here, with my comment on the original thread:  Vote to close as S&A.  On the other hand, perhaps (since this is particularly related to SE) we might carry this over to Meta?",9,21,15,14,21,A233ONYNWKDIYF,A3E157ZN8XPUKJ,ARYGQ46IMW8AU,A28TXBSZPWMEU9,A13HSR88OUNIVP,0.034261793,16,Polite,0.892500971
092011 Stack Overflow,4239163,What separates movie title with the release date? Is it a tab ?,13,17,14,18,18,AYG3MF094634L,A3OW54MEVDKXJL,A14TK8NCD4CUN1,A3EJ5TT2ZGBIDA,A17G2LOYX7WQZ,0.405606751,16,Polite,0.523813345
092011 Programmers,112595,"Sorry, but I don't buy it. Why should we be sheep because exceptions didn't exist in PHP over a decade ago when classes were first implemented in PHP `4.something`?",14,20,13,16,17,AYG3MF094634L,A23312XQ2AQ91W,A2UFD1I8ZO1V4G,A28TXBSZPWMEU9,AR6N5URYPDBXS,0.530536675,16,Polite,0.902653167
092011 Apple,9308,"Someone already asked this question about the Mac Pro (2,1)—see [Mac Pro video card recommendations](http://apple.stackexchange.com/questions/7561/mac-pro-video-card-recommendations). Do the responses there answer this question?",17,9,20,13,21,AO3XB5I5QNNUI,A233ONYNWKDIYF,A1FF4KWG1G44QE,A1LRRDBA84ITCJ,A13HSR88OUNIVP,0.192739117,16,Polite,0.235755455
092011 Stack Overflow,880231,"@Binary: Enough of you seem to be pretty upset about this - so I made it CW (which I didn't know about before, BTW) - do I need to do anything else?  Or am I kosher now? :)",9,16,19,17,19,A3OW54MEVDKXJL,A28TXBSZPWMEU9,A1F4D2PZ7NNWTL,APWXTMJO1I1ST,A38EGQEYZHRQNC,0.44143121,16,Polite,0.390421412
092011 Stack Overflow,1953663,"Are you going to implement your own syntax on top of the scripts (i.e. SQL, Excel etc) that the users are coding?",19,13,18,13,17,A1C9RMT7PMKWVA,A28TXBSZPWMEU9,A17G2LOYX7WQZ,A3689IWHIHX69E,AD1IH74UX9IAI,0.407161413,16,Polite,0.119658198
092011 Electrical Engineering,2029,"Are you trying to minimize the material cost, or just beat the commercial version's price? How much do the commercial ones cost, roughly?",17,14,18,18,13,AO3XB5I5QNNUI,A3RLCGRXA34GC0,A23312XQ2AQ91W,A1KC138MX47DXA,A2UFD1I8ZO1V4G,0.41795473,16,Polite,0.766612863
092011 Gaming,18129,What is special with Zergs? Could you please extend you answer for them too?,13,13,20,21,13,A233ONYNWKDIYF,A1ZHP80O13CEUI,A23312XQ2AQ91W,A3E157ZN8XPUKJ,A2UFD1I8ZO1V4G,0.259170398,16,Polite,0.139270464
092011 Stack Overflow,7633387,What is the perl code in question? What does your error_log say?,13,21,16,13,17,A1ZHP80O13CEUI,A2RDZ580VXUO1X,A17G2LOYX7WQZ,A34M93NJC830DP,A38EGQEYZHRQNC,0.199565467,16,Polite,0.778423693
092011 Programmers,4168,@Fishtoaster I'm confused though how to reword it though. What category *is* phpMyAdmin?,13,21,13,20,13,AO3XB5I5QNNUI,A3E157ZN8XPUKJ,A2UFD1I8ZO1V4G,ALK595458N4IR,A3GOI327COFGY5,0.245947584,16,Polite,0.91186339
092011 Stack Overflow,1599636,"I don't think this is a duplicate, mghie - JVNR seems to want to check if it ran as well, which I don't think that other SO question really addresses - and it's certainly not in the accepted answer.  Also, JVNR, I think you could edit the question title to be a bit clearer or help other people find the question - maybe mention ""running"" a Perl script, not ""automate"", and something about checking if it ran or not?",21,17,21,13,8,A3H8M155NBFE1L,A2UFD1I8ZO1V4G,A1KC138MX47DXA,AD1IH74UX9IAI,A3OY0OL2M0HUTT,0.367461801,16,Polite,0.448206296
092011 GIS,6717,Mtrombley--you said you got a solution. Can you post it?,9,21,16,13,21,AO3XB5I5QNNUI,ALQJX7I6J8LDT,A23312XQ2AQ91W,A2UFD1I8ZO1V4G,A13HSR88OUNIVP,-0.033578916,16,Polite,0.613740957
092011 Ask Ubuntu,1167,"What kind of network interface are you talking about? eth, wireless, ... ?",9,13,24,13,21,AO3XB5I5QNNUI,ALQJX7I6J8LDT,A23312XQ2AQ91W,A2UFD1I8ZO1V4G,A13HSR88OUNIVP,-0.017427077,16,Polite,0.568994111
092011 Stack Overflow,3621474,"Actually, it worked locally but then did not work live on the site.  On the site it is still saying ""Access Denied"" even if calling the jQuery file from the same domain/subdomain combination... any thoughts?",13,14,16,15,22,A233ONYNWKDIYF,AYG3MF094634L,A28TXBSZPWMEU9,A14TK8NCD4CUN1,A2MTJNQT1A0W3S,0.810196107,16,Polite,0.867495824
092011 Stack Overflow,8040671,"Updated with more code. I have not implemented INotifyChanged, perhaps thats what I need to do?",13,10,18,18,21,A233ONYNWKDIYF,A14TK8NCD4CUN1,A17G2LOYX7WQZ,A1KC138MX47DXA,A3OY0OL2M0HUTT,0.171032574,16,Polite,0.226005698
092011 Stack Overflow,1868965,"@kelton52, then the problem is at compile time rather than run time. There should still be behaviour, error messages from the compiler perhaps?",21,12,17,13,17,A1UIH2IMG9DV95,A1K8E2E0HHRZ4S,A2TK0FA154PHP0,AO3XB5I5QNNUI,A1F4D2PZ7NNWTL,0.701532946,16,Polite,0.012559991
092011 Stack Overflow,4670453,`static_assert`? Are you using C++0x?,21,13,13,15,18,APEJ17EE0VDDT,A233ONYNWKDIYF,A3MMLCBV2W3BP9,AD1IH74UX9IAI,A3OY0OL2M0HUTT,0.418349501,16,Polite,0.386923374
092011 Stack Overflow,7293103,I'm not sure I understand exactly what you want. Could you clarify?,17,16,16,15,16,A2UFD1I8ZO1V4G,A28TXBSZPWMEU9,A3EJ5TT2ZGBIDA,A2BKPNKU3EG41Z,AP6784DKV31O6,0.613490568,16,Polite,0.597628948
092011 Stack Overflow,2329118,Is the asterisk really an asterisk in the source code? Or just a wildcard?,17,21,13,16,13,A26GZ6M5B80ZZQ,A3E157ZN8XPUKJ,A1EFWZTCRESQ0K,A1F4D2PZ7NNWTL,A1HBDQ0BJQBA4Q,0.143305726,16,Polite,0.612126279
092011 Stack Overflow,4262505,"Is the junk always the same, or is it different for each file? Also, what format is the date in?",13,18,13,15,21,A2UFD1I8ZO1V4G,A33SMNMTMIOJ6T,A233ONYNWKDIYF,A2BKPNKU3EG41Z,A3OY0OL2M0HUTT,0.481691695,16,Polite,0.087966578
092011 Theoretical Computer Science,4117,Surprising how many examples are about topology and geometry. Are we just more surprised by these two topics ?,21,17,17,15,10,A233ONYNWKDIYF,A23312XQ2AQ91W,A2UFD1I8ZO1V4G,A28TXBSZPWMEU9,A1T5YMBH35PDBX,0.726281613,16,Polite,0.032488289
092011 Stack Overflow,3725730,UniversalIndentGUI is a front-end for many different formatting tools. Which one are you using?,13,15,18,15,19,A2UFD1I8ZO1V4G,A3EJ5TT2ZGBIDA,A17G2LOYX7WQZ,A2BKPNKU3EG41Z,A1Z7WT01G55LDC,0.102019588,16,Polite,0.354882962
092011 Stack Overflow,3021158,"Looks like `CodeMirror.fromTextArea('code', options);` returns `undefined`. Maybe you are passing the wrong arguments to that function?",17,21,16,13,13,AL97SCCNKZILP,A3E157ZN8XPUKJ,A2OTEOJC764LEP,A14TK8NCD4CUN1,A2GSW5RBAT5LQ5,0.356112958,16,Polite,0.564743028
092011 Bicycles,3186,What kind of traffic do these roads see? How many lanes in each?,24,13,17,13,13,A23312XQ2AQ91W,A2UFD1I8ZO1V4G,A32VJLRWGMYGSU,ARX0S1CIDJLOX,A1LRRDBA84ITCJ,0.367496499,16,Polite,0.558983613
092011 Stack Overflow,8380801,Ah... Hmm. Would it be possible to wrap it in Jython somehow to make it a Java applet using the code I wrote?,15,19,15,10,21,AYG3MF094634L,A1EFWZTCRESQ0K,A1F4D2PZ7NNWTL,A2MOSNEX4E7G1P,AP6784DKV31O6,0.581214062,16,Polite,0.175947258
092011 Stack Overflow,2429690,"Sounds like it was trying to go down the stack, but found itself going up instead. I'm not sure how that might have happenedstack smashed?",15,13,21,14,17,A1ZHP80O13CEUI,A28TXBSZPWMEU9,A3SMTP08PPXDWA,A14TK8NCD4CUN1,A2WGBPEN45GJNF,0.681810343,16,Polite,0.104213167
092011 Webmasters,10920,POST implies you want to send some data to the server. Why wouldn't you just use GET when all you want to do is GET data?,13,17,16,17,17,AO3XB5I5QNNUI,A2UFD1I8ZO1V4G,A28TXBSZPWMEU9,A32VJLRWGMYGSU,ARX0S1CIDJLOX,0.704507825,16,Polite,0.106756386
092011 Stack Overflow,5051858,"I'm sorry, but your example only makes me more confused. Why don't you first put the first `r` into the first container, the second `b` into the second container, and the next two `r` into the first container, getting the sum of `0`?",18,15,16,11,20,AL97SCCNKZILP,AYG3MF094634L,A3E157ZN8XPUKJ,A125P73OQSRNI5,A34M93NJC830DP,0.722566249,16,Polite,0.131543048
092011 Electrical Engineering,6027,"This would be answered in pretty much any beginner's tutorial, and I fear a complete answer here would undermine your understanding more than help. What prior effort have you done to learn?",9,22,19,13,17,A233ONYNWKDIYF,A23312XQ2AQ91W,ARYGQ46IMW8AU,A2UFD1I8ZO1V4G,A32VJLRWGMYGSU,0.410588958,16,Polite,0.074043741
092011 Photography,18383,"@fmark: Good for you. Why is this comment (from a thread that's now 3 months old, no less) directed at me?",21,18,13,15,13,A3E157ZN8XPUKJ,A1KC138MX47DXA,A2FNOKJNY7E5WP,A28TXBSZPWMEU9,A32VJLRWGMYGSU,0.340268439,16,Polite,0.731076428
092011 Stack Overflow,956481,JNDI lookup is the way. Can you confirm in your startup logs that the datasource actually deploys?,13,21,15,16,15,A26GZ6M5B80ZZQ,A3E157ZN8XPUKJ,A1EFWZTCRESQ0K,A1F4D2PZ7NNWTL,A1HBDQ0BJQBA4Q,0.214076119,16,Polite,0.887264981
092011 Webmasters,2161,"Despite the good answers, this is still a REALLY poor question a) because of the lack of information and confusing wording b) because - depending on what the question actually is - it's unlikely to be of use to anyone else. Can someone with edit permissions tidy it up ASAP, please?",13,21,15,9,22,AO3XB5I5QNNUI,ALK595458N4IR,A28TXBSZPWMEU9,ARX0S1CIDJLOX,A13HSR88OUNIVP,0.285636345,16,Polite,0.538583767
092011 Stack Overflow,5560383,"How would look your formula like after removing one, two, or all connectives? Could you give an example?",16,13,18,16,17,A3RP70I4XDGOIS,ACQ5ARKNBGZKY,A872FSFU7WV6W,A2BKPNKU3EG41Z,A1Z7WT01G55LDC,0.530667366,16,Polite,0.174365799
092011 Stack Overflow,273641,"Many languages can do this in their standar libraries. Any prefered language or do you want a ""pure"" algorithm?",13,16,13,17,21,A3689IWHIHX69E,AD1IH74UX9IAI,A150TBAWIYV8J4,AP6784DKV31O6,A3OY0OL2M0HUTT,0.431678809,16,Polite,0.131059908
092011 Stack Overflow,3434857,"I understand the auditing, but I'm a bit puzzled about the purpose of the beanMap and why you extract string valued properties. Can you explain what you want to achieve?",15,14,9,17,25,AQRI1E9W5268O,A14TK8NCD4CUN1,AO3XB5I5QNNUI,A3EJ5TT2ZGBIDA,A3DKR227NQCH4X,0.372444168,16,Polite,0.15967838
092011 Stack Overflow,6143469,"What kind of input are you looking for, give little more details. [CommonDialog](http://msdn.microsoft.com/en-us/library/system.windows.forms.commondialog.aspx) look at the classes inheriting it do any of them look right for you?",13,16,18,13,20,A23FB7HE970AZJ,A28TXBSZPWMEU9,A17G2LOYX7WQZ,A3TXO6RKFIDFUV,A2WGBPEN45GJNF,0.579995405,16,Polite,0.98955966
092011 Stack Overflow,2674345,"Is it a directed, acyclic graph? or are cycles allowed?",17,17,17,16,13,A3OW54MEVDKXJL,A125P73OQSRNI5,AD1IH74UX9IAI,A39FH0T1NKKMVO,A321FJYVTX5WP9,0.565765378,16,Polite,0.664251618
092011 Stack Overflow,5573660,What's the declaration for v1 and v2? Are they of the correct type for %f?,21,13,17,15,14,A3G9MSZVWB7W42,A23FB7HE970AZJ,A320SR22MPGY17,A3DGKW5JY87RCH,A21TVGREPIDWBV,0.408293112,16,Polite,0.569324074
092011 Stack Overflow,6693887,Is TBL#Sell2 empty before you copy the rows? Are all SellId in TBLSell empty before copy?,13,15,13,18,21,A3689IWHIHX69E,AD1IH74UX9IAI,A150TBAWIYV8J4,AP6784DKV31O6,A3OY0OL2M0HUTT,0.429982035,16,Polite,0.959961347
092011 Cooking,2865,"Since this came up in another question, is there a UK equivalent for what we in the US call ""biscuits""?  The Cookies -> Biscuits correlation is listed above, but what about Biscuits -> ??",12,17,13,25,14,A13CO3B2BRXQLZ,A2UFD1I8ZO1V4G,A2K67U9JPRTK2U,A1FF4KWG1G44QE,AKWJ5294VIZRR,0.324808884,16.2,Polite,0.04063203
092011 Stack Overflow,1417177,"Do you have the ability to authenticate users (through login or whatnot) and to ""grade"" them, a bit like SO users. In this fashion you will soon get enough ""trusted citizen"" susceptible of flagging offensive data ?",19,13,17,14,18,A2AE4MZVUX9JPX,A28TXBSZPWMEU9,A1HBDQ0BJQBA4Q,AP6784DKV31O6,A321FJYVTX5WP9,0.396948115,16.2,Polite,0.745400964
092011 Gaming,14741,"OK @Juan - the meta question has established unequivocally that questions like this are definitely allowed. Could you ""un-close"" it now?",13,21,13,13,21,AYG3MF094634L,A3E157ZN8XPUKJ,A2UFD1I8ZO1V4G,A32VJLRWGMYGSU,A13HSR88OUNIVP,-0.046480186,16.2,Polite,0.731204543
092011 Android Enthusiasts,78,"I don't see ""Set alarm..."" in the list of Voice Actions (http://www.google.com/mobile/voice-actions/).  Are you sure it is one?",13,21,13,21,13,A233ONYNWKDIYF,A3E157ZN8XPUKJ,A28TXBSZPWMEU9,A2MWGIVIKOXWYM,A1LRRDBA84ITCJ,0.23625788,16.2,Polite,0.119402118
092011 Stack Overflow,3362493,"Please, share more details, configured Application Pools, publishing configuration (realease, debug, ...). Is the IIS on the same machine?",20,13,18,15,15,AO5E3LWBYM72K,A14TK8NCD4CUN1,A17G2LOYX7WQZ,A2BKPNKU3EG41Z,A39FH0T1NKKMVO,0.255216686,16.2,Polite,0.084761186
092011 Stack Overflow,7274149,Version 1.2.0 has now been released: http://www.redmine.org/projects/redmine/wiki/Changelog#120-2011-05-30. Can you try that instead?,17,15,21,15,13,A14UM4W7GVDF3R,AGFHIO3UKJ9EF,A1G05O3HM7DNVZ,A39FH0T1NKKMVO,A3OY0OL2M0HUTT,0.15832816,16.2,Polite,0.505194739
092011 Stack Overflow,4271943,"What are you trying to prevent? Just hotlinking, or do you want user/membership based access permissions?",21,21,11,15,13,A3E157ZN8XPUKJ,AGFHIO3UKJ9EF,A14TK8NCD4CUN1,A17G2LOYX7WQZ,A1GK3MPU2HL0C8,0.106114866,16.2,Polite,0.763857124
092011 Unix and Linux,23183,"Please tell us you're not trying to write a root-kit. Can you explain your scenario so that perhaps we can suggest a better security architecture instead of one that is generally considered ""evil"" behavior?",17,13,21,17,13,A23312XQ2AQ91W,A2UFD1I8ZO1V4G,A32VJLRWGMYGSU,A1W2G1N4BDF2DW,A1LRRDBA84ITCJ,0.257714985,16.2,Polite,0.120826526
092011 Stack Apps,2491,Follow-up question: There are some slight errors on the elapsed times displayed on the site due to treating all months uniformly as 30 days and ignoring leap years.  Do you think it's a good idea to keep these errors to match the site (see my answer) or should we try to fix them?,16,21,15,13,16,AO3XB5I5QNNUI,A3E157ZN8XPUKJ,A1KC138MX47DXA,A2UFD1I8ZO1V4G,A28TXBSZPWMEU9,0.421551876,16.2,Polite,0.345433463
092011 Android Enthusiasts,325,How are you trying to tether? Are you using PDAnet?,21,13,13,13,21,A3E157ZN8XPUKJ,A2UFD1I8ZO1V4G,A771BLWJLMWYY,A28TXBSZPWMEU9,A2MWGIVIKOXWYM,0.008619727,16.2,Polite,0.233827007
092011 Apple,831,Are you unable to change it back? Or are you just curious as to how it got changed?,17,13,17,13,21,ARYGQ46IMW8AU,A2UFD1I8ZO1V4G,A1FF4KWG1G44QE,A1XKHXJ8CMIX7N,A1LRRDBA84ITCJ,0.526911851,16.2,Polite,0.359627227
092011 Webmasters,5678,"Do you want real data, or just test data (i.e. fictional)?",13,21,13,13,21,AYG3MF094634L,A3E157ZN8XPUKJ,A2UFD1I8ZO1V4G,A32VJLRWGMYGSU,A13HSR88OUNIVP,-0.046480186,16.2,Polite,0.439352005
092011 Stack Overflow,6471817,"The FAQ says Stack Overflow covers ""matters that are unique to the programming profession,"" and this seemed to me like such a matter.  Or did I miss something?",13,20,11,20,17,A233ONYNWKDIYF,A17G2LOYX7WQZ,A1F4D2PZ7NNWTL,AP6784DKV31O6,A38EGQEYZHRQNC,0.276251342,16.2,Polite,0.639756917
092011 Stack Overflow,4009829,"can you clarify - do you have a time with timezone as input, and want time and different timezone as output?  Or is the input time GMT?",17,13,13,17,21,A416CQ0FIDNFT,ARYGQ46IMW8AU,A3MMLCBV2W3BP9,A125P73OQSRNI5,AFHAH1BIN51GI,0.460479635,16.2,Polite,0.69722179
092011 Unix and Linux,7978,It sounds like you're trying to dump LiveCD images for various distributions onto a USB drive and then be able to boot them.  Is this correct?,21,17,17,21,5,A233ONYNWKDIYF,ARYGQ46IMW8AU,A2UFD1I8ZO1V4G,A32VJLRWGMYGSU,AI4WWBB2PNCKH,0.796325868,16.2,Polite,0.956316482
092011 Stack Overflow,1688539,Please explain the kind of statistics you are trying to gather. Is it just number of loads or urls or is there some callback info you want when the user is using your widget?,21,13,15,13,19,A2WRP1KHK1UU7L,A3MMLCBV2W3BP9,A14TK8NCD4CUN1,AO3XB5I5QNNUI,A1Z7WT01G55LDC,0.661726235,16.2,Polite,0.490105929
092011 Android Enthusiasts,6467,"Matt H's comment covers the ""how"".  As for ""Is it legal?""...",5,9,21,21,25,AO3XB5I5QNNUI,A233ONYNWKDIYF,A2UFD1I8ZO1V4G,A32VJLRWGMYGSU,A2MWGIVIKOXWYM,0.548485662,16.2,Polite,0.836385974
092011 Stack Overflow,7444996,What language/platform are you using for parsing? What library?,13,17,16,17,18,A2UFD1I8ZO1V4G,A1KYGP10BH4FXU,A3EJ5TT2ZGBIDA,AD1IH74UX9IAI,A39FH0T1NKKMVO,0.636122398,16.2,Polite,0.272333414
092011 Drupal Answers,5945,"sorry, last question..alot of my fucntionality is gone(it was an autocomplete search field)...does this mean I have to add all the elements I want back into my module above? or is there a way for it to only modify what I tell it to change?",15,17,13,19,17,A1E0EK09CA5OIO,AO3XB5I5QNNUI,A233ONYNWKDIYF,A1KC138MX47DXA,A1CIIX0CB0GR7H,0.523062011,16.2,Polite,0.303425671
092011 Stack Overflow,5826331,"Maybe mine is a stupid question, but... Are you running the program normally? or using the debug button?",24,13,13,18,13,APEJ17EE0VDDT,A233ONYNWKDIYF,A3MMLCBV2W3BP9,AD1IH74UX9IAI,A3OY0OL2M0HUTT,0.508123222,16.2,Polite,0.442167049
092011 Stack Overflow,7119050,Do you get any sort of error in Instruments when you plugin your iOS device? Is your iPhone Developer Program Membership up to date?,15,17,15,13,21,AQRI1E9W5268O,A33SMNMTMIOJ6T,ARYGQ46IMW8AU,A28TXBSZPWMEU9,A1Z7WT01G55LDC,0.469568294,16.2,Polite,0.625580092
092011 Stack Overflow,7391512,"Can you give us a simple, dummy example to explain what you're trying to do? eg give us an example of a batch of the kind of repeated text/html you'd hope the code would catch?",15,15,17,17,17,AYG3MF094634L,A1ZHP80O13CEUI,A28TXBSZPWMEU9,A1G05O3HM7DNVZ,A125P73OQSRNI5,0.923308876,16.2,Polite,0.396577207
092011 Stack Overflow,7429453,"@Daniel: Can't reproduce with Windows 7 `cmd.exe`, and I don't remember a ever using a text-only (no curses or anything) command line application that reacts on ESC. Perhaps some shells pass ESC one (but what character code would that be?).",17,13,13,17,21,A3R637QBE0IXDF,A233ONYNWKDIYF,A28TXBSZPWMEU9,AP6784DKV31O6,A3DKR227NQCH4X,0.287001538,16.2,Polite,0.098324226
092011 Cooking,2238,"@Joe Hmm, I guess I would call them both of those jam -- they seem to be approximately the same condiment to me. :)  Maybe the mashed fruit one could also be called a conserve?",17,21,13,13,17,AO3XB5I5QNNUI,A3E157ZN8XPUKJ,A2UFD1I8ZO1V4G,A28TXBSZPWMEU9,A13HSR88OUNIVP,0.017637877,16.2,Polite,0.515066832
092011 Stack Overflow,3010345,hi Gabe what is your reason to activate the USB Debug with fastboot? why don't use Settings > Application settings > Development > USB debugging???,10,19,21,18,13,AZJOGRB07OS28,ARYGQ46IMW8AU,A3MMLCBV2W3BP9,A39FH0T1NKKMVO,A2GSW5RBAT5LQ5,0.822689607,16.2,Polite,0.406821256
092011 Stack Overflow,8060241,Are there any additional assumptions? E.g. O(1) size for the set of point-to nodes?,13,13,21,21,13,A28TXBSZPWMEU9,AP6784DKV31O6,A3DKR227NQCH4X,A28WCYNS229OHH,A2GRSJHXTR7JQR,0.275714007,16.2,Polite,0.281897076
092011 Stack Overflow,8664233,"In the sample, there's a space after `another_question? \ `. Does the space exist in the original code?",13,17,16,21,14,A1BS64O3JY0YJ4,A2UFD1I8ZO1V4G,AO2NFSIXUL5MT,A17G2LOYX7WQZ,A2BKPNKU3EG41Z,0.494995515,16.2,Polite,0.396598165
092011 Stack Overflow,7661119,"How sparse is the matrix?  Does the matrix have any special shape, or relationship between entries?",13,13,17,21,17,A2NPNKSW89BODS,A2USG66RL7MM4E,A1LD0QIDVO016U,A2BKPNKU3EG41Z,A28WCYNS229OHH,0.85359106,16.2,Polite,0.248487644
092011 Stack Overflow,6612714,@ yoda ...Done ! i edited it :) hey are you personally good at image processing in matlab ?,13,17,21,17,13,A233ONYNWKDIYF,A28TXBSZPWMEU9,A1G05O3HM7DNVZ,A1WVVULO7SS6AY,A312BVGKE6BAS5,0.795475634,16.2,Polite,0.220273451
092011 Ask Ubuntu,1858,What version of Exchange server is this? <= 2003 or > 2003?,13,21,13,13,21,AO3XB5I5QNNUI,A3E157ZN8XPUKJ,A34A7196LM26TV,A32VJLRWGMYGSU,A3U7P73AIQVS9S,0.34246492,16.2,Polite,0.347164072
092011 Stack Overflow,5796968,"Could you clarify what you mean by ""zoom?"" Are you referring to the effects of `Ctrl +` and `Ctrl -`?",21,21,13,13,13,AQRI1E9W5268O,AGFHIO3UKJ9EF,A3MMLCBV2W3BP9,A14TK8NCD4CUN1,AO3XB5I5QNNUI,0.496476875,16.2,Polite,0.791101249
092011 TeX - LaTeX,25575,"@Stefan: Not sure what you mean by the comment above, sorry. Want to take it to chat?",17,17,21,13,13,A233ONYNWKDIYF,A2TVQMMI5TNQPJ,ALQJX7I6J8LDT,A2UFD1I8ZO1V4G,A28TXBSZPWMEU9,0.513454388,16.2,Polite,0.355329484
092011 Webmasters,3668,"@John, if so, bugger! I am still ranked well, I wonder if or when I will drop?",13,17,17,21,13,AO3XB5I5QNNUI,AYG3MF094634L,A233ONYNWKDIYF,A23312XQ2AQ91W,A2UFD1I8ZO1V4G,0.675080738,16.2,Polite,0.85631271
092011 Drupal Answers,1175,"Hello Arosboro, and welcome on _Drupal Answers_. May you report the code of `vtiger_portal_user_form_validate()`, which I think it is your custom form validation handler?",17,14,21,11,18,A2PXJTMWGUE5DC,A13CO3B2BRXQLZ,A3E157ZN8XPUKJ,A3JBAUWN5T7E0Q,ARYGQ46IMW8AU,0.709416976,16.2,Polite,0.974276688
092011 Stack Overflow,3912481,Seems okay to me. What is it supposed to output?,17,13,20,14,17,A2UFD1I8ZO1V4G,A28TXBSZPWMEU9,A17G2LOYX7WQZ,A2BKPNKU3EG41Z,AFD31LP2ZU9G7,0.498030547,16.2,Polite,0.93328555
092011 Stack Overflow,3705705,"What do you mean by 'variable'? More specifically, are you including fields and properties, or are you referring specifically to method-local variables?",13,21,13,17,17,A2NPNKSW89BODS,A3E157ZN8XPUKJ,A3MMLCBV2W3BP9,A17G2LOYX7WQZ,A312BVGKE6BAS5,0.402743021,16.2,Polite,0.087673523
092011 Gaming,5106,And which version of DF are you trying to run?  0.31.12?,12,21,15,15,18,AYG3MF094634L,A26PVQXPVF93M0,A3RLCGRXA34GC0,A28TXBSZPWMEU9,ARX0S1CIDJLOX,0.304225759,16.2,Polite,0.736194597
092011 TeX - LaTeX,35223,"Yeah, sorry, that's how I wrote it in the code but it was a mistake in my comment. Any idea why could this be caused?!",13,21,13,13,21,AO3XB5I5QNNUI,A3E157ZN8XPUKJ,A2UFD1I8ZO1V4G,A28TXBSZPWMEU9,A13HSR88OUNIVP,0.065581173,16.2,Polite,0.596799763
092011 Stack Apps,3183,I''ll send you some User-Agent headers and server logs. What would you like them to say?,21,12,13,14,21,A26PVQXPVF93M0,A3RLCGRXA34GC0,A2UFD1I8ZO1V4G,ARX0S1CIDJLOX,A2MWGIVIKOXWYM,-0.01454304,16.2,Polite,0.825505553
092011 Stack Overflow,7191036,It's likely `m_cAppIdMap` has been over released. Can you check that?,17,13,21,13,17,A233ONYNWKDIYF,A23FB7HE970AZJ,AO2NFSIXUL5MT,A14TK8NCD4CUN1,A17G2LOYX7WQZ,0.632728497,16.2,Polite,0.254413651
092011 Electrical Engineering,1680,What's your platform? FPGA or microcontroller?,15,21,19,13,13,A23312XQ2AQ91W,A3E157ZN8XPUKJ,ARYGQ46IMW8AU,A2FNOKJNY7E5WP,A28TXBSZPWMEU9,0.397971437,16.2,Polite,0.490307819
092011 Electrical Engineering,17482,"@Mawg Please define ""cheap"". As cheap as possible regardless of the amount of work involved?",13,13,17,17,21,AYG3MF094634L,A233ONYNWKDIYF,A2UFD1I8ZO1V4G,A1FF4KWG1G44QE,AR6N5URYPDBXS,0.621582971,16.2,Polite,0.60532218
092011 Cooking,2399,Can you give an example of a recipe that didn't work out as you hoped?,21,17,14,13,16,AQAXDL1INQC9Q,A233ONYNWKDIYF,AC3ZBDGADKP8U,A3S5L3I8O3Q2G,A3OZ8KF0HWSVWK,0.23287846,16.2,Polite,0.899622694
092011 Stack Overflow,8592122,When I see status with Firebus's Net Tab then it shows me Status 200. Is it right?,21,13,21,13,13,A3SMTP08PPXDWA,A2WGBPEN45GJNF,A3DKR227NQCH4X,A34M93NJC830DP,A312BVGKE6BAS5,0.458787814,16.2,Polite,0.520316056
