Community,Id,Request,Score1,Score2,Score3,Score4,Score5,TurkId1,TurkId2,TurkId3,TurkId4,TurkId5,Normalized Score,Average,Classification,
092011 Apple,11502,Phones generally don't even ring for more than 30 seconds. Why do you want to do this?,1,1,2,1,1,AO3XB5I5QNNUI,A233ONYNWKDIYF,A23312XQ2AQ91W,A32VJLRWGMYGSU,A13HSR88OUNIVP,-3.719464945,1.2,Rude,0.243987099
092011 Stack Overflow,1856463,WTF? Downvotes? What for?,2,1,3,1,1,A1IU19IWRI4701,A150DDNTD7AMA7,A14TK8NCD4CUN1,A1M1T2EF4Y2IW8,A2WGBPEN45GJNF,-2.978486305,1.6,Rude,0.384207693
092011 Programmers,6530,I'd like to know why someone voted to close this as Off-Topic.  Can you please explain your reasoning?,1,1,1,5,1,AO3XB5I5QNNUI,A23312XQ2AQ91W,A3E157ZN8XPUKJ,A2UFD1I8ZO1V4G,A1FF4KWG1G44QE,-3.146463729,1.8,Rude,0.769368677
092011 Programmers,49611,Career advice questions like this one are too localized for this site. Please see [Are Career Advice questions useful for anyone except the poster](http://meta.programmers.stackexchange.com/questions/588/are-career-advice-questions-useful-to-anyone-except-the-poster/590#590)?,1,5,1,1,1,A233ONYNWKDIYF,A3RLCGRXA34GC0,A3E157ZN8XPUKJ,A2UFD1I8ZO1V4G,A28TXBSZPWMEU9,-3.960218907,1.8,Rude,0.983305295
092011 Bicycles,7234,And this is why you're asking all the stupid questions?,5,1,1,1,1,A1E0EK09CA5OIO,A233ONYNWKDIYF,A3OZ8KF0HWSVWK,ARYGQ46IMW8AU,A22SZHZTF72TRM,-3.264056696,1.8,Rude,0.14561603
092011 Stack Overflow,8262957,You wouldn't be allowed to ask and post comments if you were not logged in. What kind of programmer are you?,1,1,5,1,4,A1UIH2IMG9DV95,A1H0XDGVSBL152,A3E157ZN8XPUKJ,A3MMLCBV2W3BP9,A17G2LOYX7WQZ,-2.960289146,2.4,Rude,0.435108577
092011 Programmers,72418,Not sure how this setup helps migration. Could you please elaborate?,1,5,5,1,1,AO3XB5I5QNNUI,A233ONYNWKDIYF,A2UFD1I8ZO1V4G,A2J65ZHAJQDKAC,A32VJLRWGMYGSU,-2.852886003,2.6,Rude,0.594990997
092011 Stack Overflow,6729935,"wait! If you're doing the thesis, shouldn't you be the expert?",1,3,1,6,4,A23FB7HE970AZJ,A28TXBSZPWMEU9,A3MMLCBV2W3BP9,A14TK8NCD4CUN1,A872FSFU7WV6W,-3.155445069,3,Rude,0.244651384
092011 Ask Ubuntu,4256,"IIRC, this is the same problem as with volume buttons on some ThinkPads... the hardware *just does it* and then also sends out a signal saying the button's been pressed.  Possibly you could unset the shortcut in System -> Preferences -> Keyboard Shortcuts for this action?",4,9,1,1,1,A28TXBSZPWMEU9,A1T5YMBH35PDBX,A2MWGIVIKOXWYM,A1LRRDBA84ITCJ,AR6N5URYPDBXS,-2.548105029,3.2,Rude,0.708316342
092011 Stack Overflow,6649417,Wow.  You couldn't even format your test question correctly?  How can we answer your homework for you if you can't even format it well?,5,5,3,1,3,A2X9AEDAHF7O7S,AQRI1E9W5268O,A2OXXHGAM7B0Y,A150TBAWIYV8J4,A312BVGKE6BAS5,-2.557118804,3.4,Rude,0.247040343
092011 Apple,1225,"There seems to be a problem when attempting to obtain and parse the list of video devices, the Java engine crashes. What problems did you have with Skype, also iSight related?",5,1,1,1,9,AO3XB5I5QNNUI,A3E157ZN8XPUKJ,A34A7196LM26TV,A32VJLRWGMYGSU,A3U7P73AIQVS9S,-2.265335334,3.4,Rude,0.367170147
092011 Photography,1013,"What exactly do you want to know? Equipment tips, location tips, landscape photography tips?",1,5,1,5,5,AO3XB5I5QNNUI,A233ONYNWKDIYF,A3CPYEB0W3MLZK,A2UFD1I8ZO1V4G,AI4WWBB2PNCKH,-2.573647213,3.4,Rude,0.509998169
092011 WordPress,1541,"This is a pretty broad question. Can you be more specific, please?",1,5,5,1,5,A233ONYNWKDIYF,A3CPYEB0W3MLZK,A2UFD1I8ZO1V4G,A2J65ZHAJQDKAC,A2JJLF3PI5XJ0I,-2.487294943,3.4,Rude,0.182103329
092011 Stack Overflow,5105851,It's a pretty dumb question.  Who is asking you this?,1,5,1,5,5,A1UIH2IMG9DV95,A1GGOZPHYU0OC0,A28TXBSZPWMEU9,A28ZB4ZB13BWAI,AP6784DKV31O6,-3.069798953,3.4,Rude,0.616004373
092011 Apple,10024,"Yea the password isn't the same as the lock code and on another note, she needs a better pass code! If you have contacts and pictures synced she could just setup as a fresh phone?",4,2,3,8,1,A3RLCGRXA34GC0,A23312XQ2AQ91W,ARYGQ46IMW8AU,A28TXBSZPWMEU9,A2MWGIVIKOXWYM,-3.046560902,3.6,Rude,0.710254492
092011 Stack Overflow,2971216,"Ugh, possibly the ugliest Python code I've ever seen. What are you doing?",1,1,9,6,1,A1K8E2E0HHRZ4S,A2NPNKSW89BODS,A233ONYNWKDIYF,A150TBAWIYV8J4,A39FH0T1NKKMVO,-2.575495516,3.6,Rude,0.197742853
092011 Theoretical Computer Science,1907,"You're talking about computing the coefficients of the polynomial, right?  Is this equivalent to computing the product of $\sqrt{n}$ $\sqrt{n}$-bit integers in time $\tilde O(n \log n)$ (where $\tilde O$ hides sub-logarithmic factors)?",1,5,9,1,3,AO3XB5I5QNNUI,A233ONYNWKDIYF,A2UFD1I8ZO1V4G,A1FF4KWG1G44QE,A1T5YMBH35PDBX,-2.417417894,3.8,Rude,0.634958053
092011 Theoretical Computer Science,1500,Are the k in “k-CNF” and the k in the question the same variable?  And what is the parameter of this problem?,2,1,1,9,6,AYG3MF094634L,A3CPYEB0W3MLZK,A2FNOKJNY7E5WP,A2UFD1I8ZO1V4G,A1LRRDBA84ITCJ,-2.654862572,3.8,Rude,0.899624636
092011 Webmasters,3646,"What do you mean by ""how to charge""? Are you asking how much money to charge or how to implement an ad service and payment gateway?",5,1,1,4,9,A1KQ5WV7BT3QAS,A3E157ZN8XPUKJ,A1VIEFZYI54JHP,A28TXBSZPWMEU9,A2BERTY629PZDT,-2.457428523,4,Rude,0.367677242
092011 Stack Overflow,2310255,cuz then it wouldn't be a BINARY search.  Any more obvious questions I can answer for ya?  :),5,1,5,1,9,A3OW54MEVDKXJL,A2WRP1KHK1UU7L,A125P73OQSRNI5,A1M1T2EF4Y2IW8,AE68VBES5HIPY,-2.012612605,4.2,Rude,0.479654043
092011 Bicycles,6852,"Except here is where the action took place, so here is where I questioned it. How about you answer it?",5,5,4,2,5,A233ONYNWKDIYF,A3S5L3I8O3Q2G,A3OZ8KF0HWSVWK,A21ZPWERX0DMZ2,A3IS283P2CECZJ,-2.504326975,4.2,Rude,0.308614929
092011 Game Development,25102,"@Ranieri, what would you suggest? JSON?",1,7,11,1,1,AO3XB5I5QNNUI,A23312XQ2AQ91W,A28TXBSZPWMEU9,A1FF4KWG1G44QE,A2MWGIVIKOXWYM,-2.035575454,4.2,Rude,0.31065773
092011 Web Applications,6732,I'm assuming that you want to delete the email messages on the non-Gmail account. Which email provider are you using?,1,5,5,5,5,AO3XB5I5QNNUI,A233ONYNWKDIYF,A3E157ZN8XPUKJ,A2UFD1I8ZO1V4G,A32VJLRWGMYGSU,-2.73246927,4.2,Rude,0.434967225
092011 Stack Overflow,6441143,"@Oli Because I believe that you're a troll, could you please not take part in any form in any of my future questions? Will you be able to respect my wish?",13,6,1,1,1,A233ONYNWKDIYF,AD1IH74UX9IAI,A2BKPNKU3EG41Z,A3OY0OL2M0HUTT,A2PIUQICBRBZZY,-2.108759334,4.4,Rude,0.192587353
092011 Stack Overflow,5264896,I use the [full-size version](http://training.perl.com/scripts/rename) of the rename script everyday.  Why in the world would you *not* want to use existing code?,1,5,11,1,5,A3H8M155NBFE1L,A2NPNKSW89BODS,A1HBDQ0BJQBA4Q,A3DKR227NQCH4X,A3OY0OL2M0HUTT,-1.685137688,4.6,Rude,0.446176444
092011 Stack Overflow,4678858,"@Darin Dimotrov: So you're saying that if I sent you to the supermarket to get me some beer, you will tell me you can't buy beer in a supermarket, while you actually *mean* you don't know which brand of beer to buy and whether to buy a single can, a sixpa",1,5,11,1,5,A3H8M155NBFE1L,A2NPNKSW89BODS,A1HBDQ0BJQBA4Q,A3DKR227NQCH4X,A3OY0OL2M0HUTT,-1.685137688,4.6,Rude,0.244667504
092011 Stack Overflow,6960496,"@pimvdb, No I don't. Do you have something which could lead me to a solution or just wanna make some pointless comments?",1,1,9,12,1,A2USG66RL7MM4E,A233ONYNWKDIYF,AYG3MF094634L,A14TK8NCD4CUN1,A320SR22MPGY17,-2.478283579,4.8,Rude,0.453014971
092011 Stack Overflow,4454415,You can't imagine any circumstance in which you would need a simple front end to enter information into your db? Really?,5,5,1,8,5,AO3XB5I5QNNUI,A17G2LOYX7WQZ,A872FSFU7WV6W,AD1IH74UX9IAI,A3DKR227NQCH4X,-1.916947874,4.8,Rude,0.12753379
092011 Physics,517,Maybe he wants to know why *usually* angular velocities are characterized by vectors and rotations by matrices. Is that your question?,5,9,1,5,4,AO3XB5I5QNNUI,A23312XQ2AQ91W,A3E157ZN8XPUKJ,A2UFD1I8ZO1V4G,A1FF4KWG1G44QE,-2.478963178,4.8,Rude,0.6462093
092011 GIS,1781,What exactly do you want to interpolate? What is the resolution and distribution of your measurement points?,1,5,9,5,4,AO3XB5I5QNNUI,A3IS283P2CECZJ,A2UFD1I8ZO1V4G,A2JJLF3PI5XJ0I,ARX0S1CIDJLOX,-2.2042075,4.8,Rude,0.671727471
092011 Stack Overflow,1704304,Sounds like a good homework question.  Does your instructor know you're cheating?,5,5,4,5,5,A2UME0TSE7N41G,AQRI1E9W5268O,A33SMNMTMIOJ6T,A3DKR227NQCH4X,A321FJYVTX5WP9,-1.914681974,4.8,Rude,0.030181076
092011 Stack Overflow,8218237,miles per hour? really?,10,1,7,5,1,AYG3MF094634L,A3MMLCBV2W3BP9,A17G2LOYX7WQZ,A3TXO6RKFIDFUV,AFD31LP2ZU9G7,-2.800460734,4.8,Rude,0.730513751
092011 Apple,25038,"""non-default screen resolutions when using virtual display over screen sharing"" — a statement, not a question. Please: do you *prefer*, or wish to *avoid* the non-default resolutions?",9,9,4,1,1,AO3XB5I5QNNUI,A233ONYNWKDIYF,A23312XQ2AQ91W,A28TXBSZPWMEU9,ARX0S1CIDJLOX,-2.316361853,4.8,Rude,0.049819336
092011 Stack Overflow,275141,"Wait  you're writing a thesis and you've got *no clue how to use it*? Wow. Usually, it should be the other way round, shouldn't it?",2,1,12,2,7,A33SMNMTMIOJ6T,A1GGOZPHYU0OC0,A14TK8NCD4CUN1,AO3XB5I5QNNUI,A17G2LOYX7WQZ,-2.427729114,4.8,Rude,0.635144957
092011 Stack Overflow,7127187,show some code ? what u mean not work ?,5,1,9,1,9,A2NPNKSW89BODS,A2USG66RL7MM4E,A1LD0QIDVO016U,A2BKPNKU3EG41Z,A28WCYNS229OHH,-2.039207033,5,Rude,0.085590648
092011 Apple,3154,"To suggest an answer we need to know which application you want to open this file in. Is it a command line application (aka vi or emacs on the command line) or is it another text editor (TextEdit, TextMate, Eclipse?)",5,5,9,1,5,AO3XB5I5QNNUI,A1KC138MX47DXA,A2UFD1I8ZO1V4G,A1FF4KWG1G44QE,A3U7P73AIQVS9S,-1.707499178,5,Rude,0.607990464
092011 Stack Overflow,6732363,"And what is your question? Surely you don't expect a solution, as then you wouldn't have been doing your homework?",9,8,4,3,1,A2UFD1I8ZO1V4G,A14TK8NCD4CUN1,A17G2LOYX7WQZ,A150TBAWIYV8J4,A3DKR227NQCH4X,-2.266292871,5,Rude,0.872561864
092011 Stack Apps,5233,"I know it is only after V3, but will there be at least the ability to retrieve the mod flag messages, or a count of the number of moderator flags at some point? Also will you at one point be willing to review the moderator ability features?",1,5,5,9,5,A1KQ5WV7BT3QAS,A3E157ZN8XPUKJ,A1VIEFZYI54JHP,A28TXBSZPWMEU9,A2BERTY629PZDT,-2.007201646,5,Rude,0.179347607
092011 TeX - LaTeX,39059,"I'm not understanding ""The first paragraph of http://www.ctan.org/starter.html needs an update.""  How, please?",5,5,9,5,1,AO3XB5I5QNNUI,A233ONYNWKDIYF,A2UFD1I8ZO1V4G,A771BLWJLMWYY,A2MWGIVIKOXWYM,-2.099292348,5,Rude,0.246370785
092011 Web Applications,3042,An empty inbox?  What's that?,5,5,6,1,9,A29EAR6TICPYE,A233ONYNWKDIYF,A3RLCGRXA34GC0,A3E157ZN8XPUKJ,A32VJLRWGMYGSU,-2.205132226,5.2,Rude,0.202534337
092011 Stack Overflow,8269614,? EXPLAIN PLEASE! WHERE WOULD I DO THAT @ ?,5,3,5,4,9,A26GZ6M5B80ZZQ,A3E157ZN8XPUKJ,A1EFWZTCRESQ0K,A1F4D2PZ7NNWTL,A1HBDQ0BJQBA4Q,-2.785578651,5.2,Rude,0.404164605
092011 Bicycles,8068,"Is there a reason why all of you on here seem to be anti-car? I would find this amusing, but highly inappropriate behavior from our mayor in Seattle. Why is it something to laud here?",5,5,2,5,9,A233ONYNWKDIYF,A3S5L3I8O3Q2G,A3OZ8KF0HWSVWK,A21ZPWERX0DMZ2,A3IS283P2CECZJ,-2.298707139,5.2,Rude,0.891435564
092011 Stack Overflow,5270568,Not even proper sentences? Are you currently in an exam?,11,5,4,1,5,A2TMSM19YCEXLE,A28ZB4ZB13BWAI,A39FH0T1NKKMVO,AFD31LP2ZU9G7,A3OY0OL2M0HUTT,-2.25237841,5.2,Rude,0.412336207
092011 Stack Overflow,5456195,"...have you considered implementing it yourself? You *are* a programmer, aren't you?",1,1,7,9,8,A1UIH2IMG9DV95,A23FB7HE970AZJ,A17G2LOYX7WQZ,A2BKPNKU3EG41Z,A3L459M9ME6WKI,-2.077445081,5.2,Rude,0.203502031
092011 Stack Overflow,8398081,You again? Why don't you go do your homework?,10,6,5,4,1,AYG3MF094634L,A17G2LOYX7WQZ,A39FH0T1NKKMVO,A34M93NJC830DP,A3OY0OL2M0HUTT,-2.974496489,5.2,Rude,0.809058404
092011 Stack Overflow,7021123,any code? or do we have to guess at how you did it?,1,9,7,5,5,A3H8M155NBFE1L,A2UFD1I8ZO1V4G,A1KC138MX47DXA,AD1IH74UX9IAI,A3OY0OL2M0HUTT,-2.077813166,5.4,Rude,0.823905782
092011 Stack Apps,6351,@H.B.: Any chance the `f` was a unicode character instead of a standard f?,1,5,13,5,3,A125P73OQSRNI5,A1KC138MX47DXA,A2UFD1I8ZO1V4G,A3GOI327COFGY5,AI4WWBB2PNCKH,-2.147576554,5.4,Rude,0.096356687
092011 Stack Overflow,2535216,"no offense, kid, but you're trying to build a chess game and are struggling to put labels on a board? Don't you think this kind of program is a little bit out of your league?",9,1,9,5,3,A1BS64O3JY0YJ4,A416CQ0FIDNFT,A28TXBSZPWMEU9,A1G05O3HM7DNVZ,A14TK8NCD4CUN1,-2.630683127,5.4,Rude,0.801403012
092011 Stack Overflow,3996063,This same question was asked almost word-for-word about two hours ago. Hasn't anyone ever heard of Google?,1,8,3,10,5,A2AE4MZVUX9JPX,A2UME0TSE7N41G,A17G2LOYX7WQZ,A1F4D2PZ7NNWTL,A34M93NJC830DP,-2.202650067,5.4,Rude,0.983862805
092011 Stack Overflow,4093555,You think mapping strings to a variable's symbolic name is a good idea?  Why in the world would you think that?,13,5,5,3,1,A14UM4W7GVDF3R,AGFHIO3UKJ9EF,A1G05O3HM7DNVZ,A39FH0T1NKKMVO,A3OY0OL2M0HUTT,-2.402281835,5.4,Rude,0.302295555
092011 Android Enthusiasts,10708,"What is wrong, are you making a comment to Elderathis answer, or are you adding your own answer? If you're adding your own answer please expand a bit on this, I don't believe the base Clockworkmod can help you unless you've previously done full ROM backups, or follow the links on Elderathis post to get hold of the approriate ROMs (stock or custom)?",5,1,5,7,9,A233ONYNWKDIYF,A3E157ZN8XPUKJ,ARYGQ46IMW8AU,A28TXBSZPWMEU9,A13HSR88OUNIVP,-3.000506626,5.4,Rude,0.102727788
092011 Stack Overflow,1350894,@Thomas P: hahah!! apropos Dijkstra huh?!,4,9,1,1,13,A1KYGP10BH4FXU,A1H0XDGVSBL152,A872FSFU7WV6W,A3DKR227NQCH4X,A3OY0OL2M0HUTT,-1.249793281,5.6,Rude,0.380613775
092011 Android Enthusiasts,5719,"Also, I seem to be missing that GPS checkbox from the settings interface... After Review i see Shutter Sound which should be on the next page according to the screenshot above. Any clues?",2,9,9,3,5,AO3XB5I5QNNUI,A3RLCGRXA34GC0,A23312XQ2AQ91W,A1KC138MX47DXA,A1FF4KWG1G44QE,-1.95856624,5.6,Rude,0.016551144
092011 Stack Overflow,2343223,"""Please explain in detail""? Really?",10,9,3,5,1,AYG3MF094634L,A1EFWZTCRESQ0K,A1F4D2PZ7NNWTL,A2MOSNEX4E7G1P,AP6784DKV31O6,-2.735357234,5.6,Rude,0.17644738
092011 Webmasters,4191,"What are you uploading the images for? Is it something that your theme will reference, or something that you want users to have access to and to be able to re-use images that you already posted in their own content?",1,9,9,6,3,A1VIEFZYI54JHP,ARYGQ46IMW8AU,A32VJLRWGMYGSU,A29B522D0BX6HN,AI4WWBB2PNCKH,-1.977713159,5.6,Rude,0.641592317
092011 Ask Ubuntu,29359,"This is tough because personal environments are usually already customized, so apples-to-apples comparisons are hard to come by.  To start, you might indicate what your system is (Ubuntu version, hardware) and even include a relevant benchmark for your current set-up?",5,5,8,9,1,A233ONYNWKDIYF,ARYGQ46IMW8AU,A28TXBSZPWMEU9,A32VJLRWGMYGSU,ARX0S1CIDJLOX,-2.203625622,5.6,Rude,0.771179526
092011 Stack Overflow,1822344,Did you try anything at all? Is this homework?,8,5,1,5,9,A28TXBSZPWMEU9,AP6784DKV31O6,A3DKR227NQCH4X,A28WCYNS229OHH,A2GRSJHXTR7JQR,-2.135329598,5.6,Rude,0.650805052
092011 Stack Overflow,2370534,So what have you found so far? Or should we do all of your homework?,1,1,13,9,4,A1UIH2IMG9DV95,A1H0XDGVSBL152,A3E157ZN8XPUKJ,A3MMLCBV2W3BP9,A17G2LOYX7WQZ,-2.063812294,5.6,Rude,0.654399762
092011 Stack Overflow,6490620,"I want a pony.  Now we're done sharing what we want, did you have a question?",1,9,16,1,1,A2AE4MZVUX9JPX,AO3XB5I5QNNUI,A17G2LOYX7WQZ,A150TBAWIYV8J4,A39FH0T1NKKMVO,-1.976602757,5.6,Rude,0.980911777
092011 Ask Ubuntu,683,"You should change the title to a question. Maybe something like ""What is the most popular Dictionary Application for Ubuntu?""",1,9,9,5,5,AO3XB5I5QNNUI,AYG3MF094634L,A233ONYNWKDIYF,A2UFD1I8ZO1V4G,A32VJLRWGMYGSU,-2.279908052,5.8,Rude,0.684464115
092011 Gaming,5060,Menu->options->keybindings?  Is that not working for some reason?,5,1,9,9,5,A233ONYNWKDIYF,A3CPYEB0W3MLZK,A2UFD1I8ZO1V4G,A2J65ZHAJQDKAC,A2JJLF3PI5XJ0I,-1.877959712,5.8,Rude,0.201967922
092011 Drupal Answers,2818,"Hello, Vladimir Alexiev; welcome on _Drupal Answers_. To which Drupal version are you interested?",5,5,9,9,1,A2TVQMMI5TNQPJ,A3RLCGRXA34GC0,A2UFD1I8ZO1V4G,A32VJLRWGMYGSU,A1FF4KWG1G44QE,-2.05398109,5.8,Rude,0.120263138
092011 Electrical Engineering,8667,You can do just about anything with one pin of a micro.  More specific please?,5,9,5,1,9,A1KC138MX47DXA,A2UFD1I8ZO1V4G,A28TXBSZPWMEU9,A1FF4KWG1G44QE,A13HSR88OUNIVP,-2.549523181,5.8,Rude,0.629692264
092011 Stack Overflow,3004607,"lol, WHAT? sry not making fun of anyone but this is hilarious the way it is asked?",1,5,9,8,6,A3H8M155NBFE1L,A2UFD1I8ZO1V4G,A1KC138MX47DXA,AD1IH74UX9IAI,A3OY0OL2M0HUTT,-2.09668713,5.8,Rude,0.556244738
092011 Stack Overflow,6573514,"BTW you typo'd the declaration of `bytes_read`. And what on earth is ""incertitude""?",9,9,4,1,6,A2UFD1I8ZO1V4G,A1G05O3HM7DNVZ,A2BKPNKU3EG41Z,A3DKR227NQCH4X,A39FH0T1NKKMVO,-2.108122758,5.8,Rude,0.445392388
092011 Stack Overflow,1384863,**0% acceptance rate?** Really?,5,5,9,5,5,A1UIH2IMG9DV95,A1H0XDGVSBL152,A3E157ZN8XPUKJ,A3MMLCBV2W3BP9,A17G2LOYX7WQZ,-2.113913416,5.8,Rude,0.496102802
092011 Drupal Answers,5411,"can you post an example for ""language fieldset"" on user-edit page, please?

I've created mymodule.module and pasted your code above, what to write in // Change $form array to alter form components? :)",1,9,13,1,5,AO3XB5I5QNNUI,A233ONYNWKDIYF,A2UFD1I8ZO1V4G,A1W2G1N4BDF2DW,A3GOI327COFGY5,-2.068732474,5.8,Rude,0.139386579
092011 Stack Overflow,8118167,"you are not giving us **nearly** enough detail to answer your question. First things first - is this a top down game, isometric, side scrolling?",4,9,1,6,9,A3RP70I4XDGOIS,ACQ5ARKNBGZKY,A872FSFU7WV6W,A2BKPNKU3EG41Z,A1Z7WT01G55LDC,-2.007397852,5.8,Rude,0.309859926
092011 Stack Overflow,3270722,what's wrong with this place? how has this question been up for an hour and no one has made a Bob Ross reference?,13,8,6,1,1,AQRI1E9W5268O,A2WRP1KHK1UU7L,A3EJ5TT2ZGBIDA,A872FSFU7WV6W,A3OY0OL2M0HUTT,-1.604274155,5.8,Rude,0.954607795
092011 WordPress,5578,You're doing two times the same thing (2xforeach) and the previous variant might just overwrite the option if the not set in $_REQUEST. Probably this is the issue?,13,5,8,2,1,AO3XB5I5QNNUI,A233ONYNWKDIYF,A23312XQ2AQ91W,A28TXBSZPWMEU9,ARX0S1CIDJLOX,-2.051606084,5.8,Rude,0.217751009
092011 Stack Overflow,7065742,You *want* to see your password in your cookie? I suppose you like it when sites email you your *forgotten password* too?,1,9,5,2,13,A3G9MSZVWB7W42,A2UFD1I8ZO1V4G,A3E157ZN8XPUKJ,A28TXBSZPWMEU9,A14TK8NCD4CUN1,-2.985045155,6,Rude,0.889826383
092011 Stack Overflow,4295284,"My answer would be: What kind of lame ass product searches for palindromes in a string. May I take a closer look at your business plan, please?",5,21,1,2,1,A1ZHP80O13CEUI,A2RDZ580VXUO1X,A17G2LOYX7WQZ,A34M93NJC830DP,A38EGQEYZHRQNC,-2.85608226,6,Rude,0.472641526
092011 Stack Overflow,5494261,What error? We should guess?,8,7,5,5,5,A1TN6BXFVYPHCB,A3EJ5TT2ZGBIDA,A1F4D2PZ7NNWTL,A39FH0T1NKKMVO,A3OY0OL2M0HUTT,-2.049048582,6,Rude,0.35682657
092011 WordPress,4302,"You do `global $post`, but at the time `content_save_pre` runs, no `$post` object exists (since you are right before saving it). Could this be your problem?",11,1,9,4,5,A23312XQ2AQ91W,A3E157ZN8XPUKJ,A2UFD1I8ZO1V4G,ARX0S1CIDJLOX,AI4WWBB2PNCKH,-1.978907933,6,Rude,0.223428058
092011 Stack Overflow,4106140,What have you tried and where are you stuck? Or are you just asking *us* to do *your* work for you?,1,13,7,2,7,A2USG66RL7MM4E,A28TXBSZPWMEU9,A14TK8NCD4CUN1,A2BKPNKU3EG41Z,AP6784DKV31O6,-2.083236928,6,Rude,0.765931851
092011 Stack Overflow,2585411,"The C specification says tm_years is ""Years since 1900.""  Why not just stick to the standard and avoid this whole mess?",4,13,2,1,11,A1KYGP10BH4FXU,A1H0XDGVSBL152,A872FSFU7WV6W,A3DKR227NQCH4X,A3OY0OL2M0HUTT,-1.076234087,6.2,Rude,0.012365138
092011 Stack Overflow,4227294,"As @Woot4Moo points out, you have already asked this question AND received decent starting points in the replies. So what have YOU done?",11,9,5,5,1,A30XX64989TZKE,A3OW54MEVDKXJL,A320SR22MPGY17,A3DKR227NQCH4X,AFHAH1BIN51GI,-1.679657073,6.2,Rude,0.202486157
092011 Stack Overflow,5209319,Subjective and argumentative?  Really?,9,1,9,7,5,A2PXJTMWGUE5DC,A3MMLCBV2W3BP9,AO3XB5I5QNNUI,A125P73OQSRNI5,A320SR22MPGY17,-1.909405807,6.2,Rude,0.508343567
092011 Stack Overflow,5481506,do you own any C++ books? if yes then why dont you try searching this in that ?,11,5,9,1,5,AYG3MF094634L,A2Y0ZGI29KQBTB,A14TK8NCD4CUN1,AFD31LP2ZU9G7,A3OY0OL2M0HUTT,-1.962796793,6.2,Rude,0.405303861
092011 Stack Overflow,4307104,"How ridiculous is the answer you're looking for? Do you want a 3-layer solution, with `i % 3` as a configurable business logic?",5,2,9,8,7,A3H8M155NBFE1L,A28TXBSZPWMEU9,A320SR22MPGY17,A39FH0T1NKKMVO,A34M93NJC830DP,-2.460205759,6.2,Rude,0.328784962
092011 Stack Overflow,2400379,"@Rajendra: I have read it carefully, and both the original problem and the converted problem can be interpreted in multiple ways. Is it that hard to give a yes or no answer?",5,9,13,3,1,A3R637QBE0IXDF,A233ONYNWKDIYF,A28TXBSZPWMEU9,AP6784DKV31O6,A3DKR227NQCH4X,-1.742535158,6.2,Rude,0.254091053
092011 Cooking,13169,"Boy, am I glad I don't have to eat your salmon. No offense, but I detest fennel, while I think dill is perfectly fine. Why would you want your fish tasting of licorice?",11,5,9,5,1,A1E0EK09CA5OIO,A233ONYNWKDIYF,A3S5L3I8O3Q2G,AAVJV2EYBWESX,A309BLCQJHQULO,-2.164279523,6.2,Rude,0.634715866
092011 Stack Overflow,5428610,Why not? And why on earth do you have these absurd constraints?,5,2,13,6,5,A1133ON5ALJKXJ,A3E157ZN8XPUKJ,A28TXBSZPWMEU9,A17G2LOYX7WQZ,A1F4D2PZ7NNWTL,-2.400956496,6.2,Rude,0.744594943
092011 Stack Overflow,7192139,"""Not a real question"" ? What is the ""not real"" part here?",9,6,10,1,5,A2UFD1I8ZO1V4G,A33SMNMTMIOJ6T,A39FH0T1NKKMVO,A312BVGKE6BAS5,A28WCYNS229OHH,-2.131286691,6.2,Rude,0.162725229
092011 Theoretical Computer Science,275,what exactly do you have in mind? Sampling or search applications?,9,9,6,2,5,A233ONYNWKDIYF,A2UFD1I8ZO1V4G,A28TXBSZPWMEU9,ARX0S1CIDJLOX,A3GOI327COFGY5,-2.309935725,6.2,Rude,0.004806875
092011 Apple,6789,I've never been able to get Mail.app to use the Exchange account that Google provides for mobile device use. Any chance they're using Google?,5,6,10,9,1,AO3XB5I5QNNUI,A23312XQ2AQ91W,A28TXBSZPWMEU9,A32VJLRWGMYGSU,A2MWGIVIKOXWYM,-1.840611329,6.2,Rude,0.845681612
092011 Ask Ubuntu,44684,Sorry @klox I don't understand. Could you explain a bit more?,7,5,1,9,9,AYG3MF094634L,A3CFNUD7VR2E1E,A3E157ZN8XPUKJ,A2UFD1I8ZO1V4G,A13HSR88OUNIVP,-2.552786213,6.2,Rude,0.725713948
092011 IT Security,2090,"I suggest re-titling the question, as this has nothing to do with ebay.  Perhaps a title like ""How can I secure my PHP website?"".",5,1,7,9,9,A233ONYNWKDIYF,A1ZHP80O13CEUI,A23312XQ2AQ91W,A3E157ZN8XPUKJ,A2UFD1I8ZO1V4G,-2.273886789,6.2,Rude,0.609986642
092011 Stack Overflow,7691201,"If you had such a list, what on earth would you do with it? The list of names in each category doesn't seem very interesting by itself; surely you don't want to actually process the content of all those grammars?",5,9,5,8,4,APEJ17EE0VDDT,A233ONYNWKDIYF,A3MMLCBV2W3BP9,AD1IH74UX9IAI,A3OY0OL2M0HUTT,-1.652882488,6.2,Rude,0.955999515
092011 Home Improvement,1140,What kind of edging are you using?  quarter round?,5,9,12,1,5,A233ONYNWKDIYF,A3RLCGRXA34GC0,A23312XQ2AQ91W,A3E157ZN8XPUKJ,A3CPYEB0W3MLZK,-1.97886571,6.4,Rude,0.598211379
092011 Ask Ubuntu,4395,Open a console and run `badblocks` as well as `fsck.ext4`. Do those programs report errors?,7,5,1,14,5,ARYGQ46IMW8AU,A2UFD1I8ZO1V4G,A1FF4KWG1G44QE,A1XKHXJ8CMIX7N,A1LRRDBA84ITCJ,-2.129102911,6.4,Rude,0.35318559
092011 Stack Overflow,1659902,"Ya, seriously.  17 questions and no selected answers?",5,13,7,5,2,A28TXBSZPWMEU9,A2Y0ZGI29KQBTB,A14TK8NCD4CUN1,A125P73OQSRNI5,AFHAH1BIN51GI,-2.363043805,6.4,Rude,0.162124687
092011 Stack Overflow,6972116,so what is your problem? You don't know how to copy the content?,5,11,3,8,5,A416CQ0FIDNFT,A28TXBSZPWMEU9,AO2NFSIXUL5MT,A17G2LOYX7WQZ,A3DKR227NQCH4X,-1.581119175,6.4,Rude,0.042930405
092011 Gaming,1651,@I Never Finish Anythi madness would be great Fun. How do I get infested by madness?,1,4,9,9,9,A3E157ZN8XPUKJ,A3TS7FYF27E59U,A2UFD1I8ZO1V4G,A28TXBSZPWMEU9,A13HSR88OUNIVP,-2.533113509,6.4,Rude,0.56922411
092011 Gaming,10967,@badp I've noticed you often use acronyms that I either need to look up or someone has to have you define for them.  Maybe you could consider typing things out instead?,12,5,1,13,1,A1ZHP80O13CEUI,A28TXBSZPWMEU9,A2JJLF3PI5XJ0I,A3S5L3I8O3Q2G,ARX0S1CIDJLOX,-1.627990114,6.4,Rude,0.093650474
092011 TeX - LaTeX,1037,"Could you tell which packages you have already tried? Would something like a long table, where you type each paragraph into a cell, be useful to you?",5,5,9,8,5,A233ONYNWKDIYF,A34A7196LM26TV,A2UFD1I8ZO1V4G,A28TXBSZPWMEU9,AR6N5URYPDBXS,-1.817436716,6.4,Rude,0.086865666
092011 Stack Overflow,8334163,"*""Obviously""*. Why not?",4,11,3,9,5,A2AE4MZVUX9JPX,AYG3MF094634L,A3FEMV3CZJYCRB,A125P73OQSRNI5,A39FH0T1NKKMVO,-1.903715207,6.4,Rude,0.751556533
092011 Stack Overflow,5550922,Updated!!!!!!!!! any one???,1,9,6,10,6,A1LZIWJ3V05K3H,APEJ17EE0VDDT,A1F4D2PZ7NNWTL,A34M93NJC830DP,A321FJYVTX5WP9,-1.568071294,6.4,Rude,0.301614842
